,created_at,text,retweet_count,favorite_count,class_predict,followers_count,predict_class_label
1591,2016-03-15 16:35:44,what if a terror attack was imminent? would apple help the fbi then? my chat w ted boutrous  ,18,34,world,0.136,1
1592,2016-03-15 15:25:26,speaking with apple attorney ted boutrous shortly as we wait for imminent filing    live on  ,9,9,tech,0.136,4
1593,2016-03-14 21:23:25,"rt  coming up  as  gdc16 kicks off,  joins  for an  exclusive chat on the future of  ttwo ",2,0,tech,0.136,4
1594,2016-03-14 17:08:39," awesome!!! i hadn't seen it!""",0,0,tech,0.136,4
1595,2016-03-14 17:08:15,oh no  i'm almost scared to watch! ,9,31,sports,0.136,2
1596,2016-03-14 17:06:26,"rt  why sean parker thinks uber xe2 x80 x99s ceo would ""thrive as a wartime leader""  (via  ",7,0,tech,0.136,4
1597,2016-03-14 02:54:46,"the full edition of studio 1 0 w  sean parker  napster to facebook to ""hacker philanthropy""  ",12,71,tech,0.136,4
1598,2016-03-13 21:14:43,"sean parker q amp a on taylor swift, twitter, facebook and more    on studio 1 0  ",15,41,business,0.136,3
1599,2016-03-13 15:50:16,"live now! my chat w  sean parker on studio 1 0    napster, fb  amp  more on  or here  ",15,47,tech,0.136,4
1600,2016-03-13 04:02:29,look who i bumped into! thanks so much to   for being our honoree tonight  buildgala ,6,44,sports,0.136,2
1601,2016-03-13 01:11:20,so excited slightly terrified to host the  gala tonight! with the amazing manuel  amp    buildgala ,8,52,sports,0.136,2
1602,2016-03-12 23:05:04, awesome!!!',0,0,sports,0.136,2
1603,2016-03-12 06:02:19,rt  another bombshell case in silicon valley       ,10,0,sports,0.136,2
1604,2016-03-12 00:20:22,at home and personal with sean parker    my tour of his la mansion for studio 1 0  ,48,97,sports,0.136,2
1605,2016-03-11 17:51:22,an open letter on the cloud by  ,7,9,sports,0.136,2
1606,2016-03-11 16:56:24,"rt  ""there aren 't any great women vcs"" is no longer an excuse  ",171,0,sports,0.136,2
1607,2016-03-09 22:49:42, just a little less drama   )',0,1,sports,0.136,2
1608,2016-03-09 22:48:17, yay!',0,0,sports,0.136,2
1609,2016-03-09 22:48:04,   i could talk to them for hours!',0,3,world,0.136,1
1610,2016-03-09 22:47:10, thank you!',0,0,tech,0.136,4
1611,2016-03-09 20:20:02,"""it 's not a pipeline problem"" says  with     internationalwomensday'",5,10,tech,0.136,4
1612,2016-03-09 20:18:23,the harsh realities about the state of women in tech with     internationalwomensday',6,20,sports,0.136,2
1613,2016-03-08 16:58:16,the elephant at linkedin  in depth with   ,6,13,sports,0.136,2
1614,2016-03-07 22:02:04,rt  the risk i will not take ,1513,0,tech,0.136,4
1615,2016-03-07 19:37:28,please subscribe! ,5,21,sports,0.136,2
1616,2016-03-07 19:34:10,"teach girls bravery, not perfection     ted talk ",13,33,sports,0.136,2
1617,2016-03-07 15:50:07,rt  linkedin xe2 x80 x99s jeff weiner q amp a  what it xe2 x80 x99s like being ceo on the stock xe2 x80 x99s worst day ever  via ,5,0,business,0.136,3
1618,2016-03-07 04:00:26,"the full edition of studio 1 0 w    on stock drop, leadership, china  ",21,73,business,0.136,3
1619,2016-03-06 18:00:39,rt  here's what linkedin xe2 x80 x99s jeff weiner says about being ceo after a 43  stock drop  w  ,14,0,business,0.136,3
1620,2016-03-06 16:55:12,studio 1 0 w   ceo  starts now! tune into  or watch here   ,9,25,tech,0.136,4
1621,2016-03-05 00:03:58,so excited to launch studio 1 0 this sunday w    sean parker  amp  more!  ,22,55,business,0.136,3
1622,2016-03-04 22:46:00,"my full chat w  three time presidential candidate  on the election, apple, uber  amp  more ",19,18,world,0.136,1
1623,2016-03-04 22:22:21,"my full chat with three time presidential candidate  on the election, apple, uber  amp  more ",4,11,world,0.136,1
1624,2016-03-04 22:20:39,"can 't think of a ""dumber idea""    my chat with gov  jerry brown re  trump  ",11,19,tech,0.136,4
1625,2016-03-04 22:18:32,"rt  i wrote an essay  my family, western mass, and the best burger shack in america  an intertwining history, ",6,0,world,0.136,1
1626,2016-03-04 19:57:12,rt  studio 1 0 returns sunday  tune in at 12pm et for our conversation with linkedin's ceo ,19,0,sports,0.136,2
1627,2016-03-04 05:32:55,rt  tomorrow on  catch  interview w   at approx  7 30am  amp  9am paci xe2 x80 xa6',11,0,business,0.136,3
1628,2016-03-04 05:32:31,   great to meet you!',0,4,sports,0.136,2
1629,2016-03-04 05:32:18,    thanks for coming!',0,1,sports,0.136,2
1630,2016-03-04 05:31:24, yes i am so uncool',0,1,tech,0.136,4
1631,2016-03-04 05:13:54,my first warriors game!!! n n prince is here! nme  is there food? ,6,73,sports,0.136,2
1632,2016-03-04 01:56:45,even the governor takes selfies ,3,43,tech,0.136,4
1633,2016-03-03 00:05:59,my in depth chat w the attorney general    do we let apple decide this issue for all?   rsac ,8,22,tech,0.136,4
1634,2016-03-02 16:36:18,"my chat w apple head lawyer ted olson, who in a poignant twist, lost his own wife in 9 11  ",9,19,sports,0.136,2
1635,2016-03-02 15:48:08,"""there isn 't a middle ground""    my chat with apple head lawyer ted olson  ",39,46,tech,0.136,4
1636,2016-03-02 14:13:51,"coming up, my interview with apple attorney ted olson! don't miss it on  6 30am pst and 9 30am est ",15,24,tech,0.136,4
1637,2016-03-02 03:19:20,"rt   xe2 x80 x9cwe're not against strong encryption, we are concerned with warrant proof encryption  xe2 x80 x9d ag lynch with  ",1,0,sports,0.136,2
1638,2016-03-02 02:10:15, thank you!!!',0,2,tech,0.136,4
1639,2016-03-02 02:09:29,"rt  our ceo, michael brown on the  encryption debate with bloomberg's  watch now   ",45,0,tech,0.136,4
1640,2016-03-02 02:09:20, we are on at 8ppt',0,0,sports,0.136,2
1641,2016-03-02 00:51:59,"new york da cyrus vance (who testified today) told me his office has 250  iphones they want to get into but can't  androids easier to hack""",6,11,sports,0.136,2
1642,2016-03-02 00:19:35,"part 2 of my interview w  ag loretta lynch    on china, hillary, trump  amp  the kkk ",4,7,business,0.136,3
1643,2016-03-01 23:38:09,"apple should remove  xe2 x80 x98guard dog xe2 x80 x99 on locked iphone, fbi chief says ",5,5,tech,0.136,4
1644,2016-03-01 23:36:50,"my full sit down w attorney general loretta lynch on apple vs fbi, hillary's emails, trump  amp  the kkk ",14,15,business,0.136,3
1645,2016-03-01 22:48:50,hanging with madame attorney general ,4,38,business,0.136,3
1646,2016-03-01 21:03:59,with the attorney general live now!!  ,3,7,business,0.136,3
1647,2016-03-01 20:02:52,about to go on stage with attorney general loretta lynch to discuss security vs privacy     rsac ,5,21,world,0.136,1
1648,2016-03-01 16:02:15,"excited to speak to attorney general loretta lynch on stage at  rsac today, then live on  ",4,13,business,0.136,3
1649,2016-03-01 03:53:17,"""i don 't buy that""    frmr  nsa head gen  keith alexander on apple vs fbi, part 2  ",17,24,tech,0.136,4
1650,2016-03-01 03:52:20,frmr  nsa head general keith alexander on apple vs  fbi    part 1  ,22,41,world,0.136,1
1651,2016-02-29 21:57:30,my exclusive with frmr nsa head gen keith alexander on apple vs fbi    3ppt today ,14,38,tech,0.136,4
1652,2016-02-28 22:40:53,algorithmic  oscars predictions from  ,7,12,world,0.136,1
1653,2016-02-28 18:58:21,"  it's going to cost you """,0,4,tech,0.136,4
1654,2016-02-26 16:54:40,rt   buildgala individual tickets almost sold out! join    to honor  of  ,2,0,business,0.136,3
1655,2016-02-24 16:51:25,scary    i feel violated just reading this  ,9,16,tech,0.136,4
1656,2016-02-24 05:14:03,"  thank you so much  i'm honored""",0,2,tech,0.136,4
1657,2016-02-24 04:17:18, agreed i was being facetious',0,0,world,0.136,1
1658,2016-02-24 04:17:01, yes i was being facetious',0,0,world,0.136,1
1659,2016-02-24 04:16:51, yes i was being facetious',0,0,world,0.136,1
1660,2016-02-24 04:16:36, i was being facetious',0,1,sports,0.136,2
1661,2016-02-23 22:34:56,yahoo stock chart almost exactly mirrors time inc  time to merge!  yhoo  time ,16,29,tech,0.136,4
1662,2016-02-23 22:20:19,next step could be tim cook testifying     via ,6,3,tech,0.136,4
1663,2016-02-23 20:58:04, so much classier than ny  welcome back!',0,4,sports,0.136,2
1664,2016-02-22 23:00:31,starts now ,0,14,sports,0.136,2
1665,2016-02-22 17:37:48,"google android head  on  mwc16, virtual reality  amp    ",15,34,tech,0.136,4
1666,2016-02-22 17:10:13,"""there is a lot of confusion""  google android head  on eu antitrust investigation  ",18,19,tech,0.136,4
1667,2016-02-22 16:25:12,"hint, it starts with an ""n""    google android head  on what 's after marshmellow  ",15,30,tech,0.136,4
1668,2016-02-19 22:58:48,apple pushes back against government efforts to get master key  via ,9,10,tech,0.136,4
1669,2016-02-19 20:45:37,rt  so donald  trump called for a boycott of apple over security   while tweeting from his iphone  ,30,0,world,0.136,1
1670,2016-02-19 20:32:59,"rt  donald trump calls for boycott of apple until the iphone maker gives the fbi access to the san bernardino killer's phon xe2 x80 xa6""",7,0,tech,0.136,4
1671,2016-02-19 19:03:48,rt  how would google handle a case like  applevsfbi?  asked android svp   ,7,0,tech,0.136,4
1672,2016-02-19 18:35:22,rt     amp  i spoke to  about the setback that helped him start   htt xe2 x80 xa6',12,0,business,0.136,3
1673,2016-02-19 18:15:45,"rt  after 6 5 years, moving on from   thank you to my amazing team  amp   for all i learned   ",6,0,sports,0.136,2
1674,2016-02-19 16:53:47,google's hiroshi lockheimer vaguely sides with apple in fbi encryption battle  via ,4,11,tech,0.136,4
1675,2016-02-19 00:51:46,what would google do? head of android  weighs in on apple vs fbi  ,40,60,tech,0.136,4
1676,2016-02-18 23:13:18,rt  we stand with  and apple (and thank him for his leadership)! ,3054,0,sports,0.136,2
1677,2016-02-18 22:08:29,what would google do if it got the same order via the fbi? part 1 of my chat w  android head  3ppt ,17,36,tech,0.136,4
1678,2016-02-18 20:45:42,rt  had a fun morning with  of  great chat about google  amp  the future of android  ,13,0,tech,0.136,4
1679,2016-02-18 16:15:31, yes new season starts in march!',0,2,sports,0.136,2
1680,2016-02-18 16:14:47,  not at all just hard to traffic so many strong opinions live',0,0,tech,0.136,4
1681,2016-02-18 16:14:16," i'll check it out!""",0,0,tech,0.136,4
1682,2016-02-18 04:25:18,"old chat w  parker conrad from 2014  ""behind every entrepreneur who 's killing it is   ""  ",2,22,world,0.136,1
1683,2016-02-18 03:18:15,a deep dive on how apple can    technically    create a key for just one phone   cc  ,14,29,tech,0.136,4
1684,2016-02-18 03:15:55,things got a little heated re  apple vs fbi on the show today   cc   ,8,18,tech,0.136,4
1685,2016-02-17 23:51:39,rt  1 5 important post by  forcing companies to enable hacking could compromise users xe2 x80 x99 privacy',2544,0,tech,0.136,4
1686,2016-02-13 02:19:22,"did unicorns, high private valuations start this public tech sell off?    debate ",7,15,business,0.136,3
1687,2016-02-13 02:14:44,"valuations have much further to fall, 25 75  more to go says   ",14,26,business,0.136,3
1688,2016-02-12 23:00:58,getting the party started w  live now  ,5,14,tech,0.136,4
1689,2016-02-12 22:18:57,  3ppt ,0,1,sports,0.136,2
1690,2016-02-12 22:11:52,"buckle up   it's a  day! my guest host for the hour today on  3ppt""",0,8,sports,0.136,2
1691,2016-02-12 03:45:04,"my chat w   on how twitter plans to ""prove the world wrong""  ",12,33,tech,0.136,4
1692,2016-02-11 23:29:23,live now!  ceo   ,3,20,tech,0.136,4
1693,2016-02-11 23:15:09,live with my guest host   ,4,30,tech,0.136,4
1694,2016-02-11 21:52:42,great show today    twitter's  and an in person visit from  ,6,11,world,0.136,1
1695,2016-02-11 21:16:04,rt  that's the new up   ,9,0,business,0.136,3
1696,2016-02-11 21:15:30, twtr ends the day down 4 47  ',7,9,business,0.136,3
1697,2016-02-11 21:01:03,rt  inside twitter's plan to add users  ,7,0,tech,0.136,4
1698,2016-02-11 21:00:22,"rt  it 's not often wall street says ""i 'm sorry "" after linkedin earnings, many admitted their thesis on  lnkd was wrong  ",13,0,business,0.136,3
1699,2016-02-11 20:32:18,very frank take on how the market bloodbath is impacting vc from    ,29,32,business,0.136,3
1700,2016-02-11 17:14:34,"how twitter plans to ""prove the world wrong""    my chat with coo   ",45,74,tech,0.136,4
1701,2016-02-11 15:58:13,"for the record,  claims ""i can be a little less nice"" (not sure i believe him)    link to come ",2,33,sports,0.136,2
1702,2016-02-11 15:09:13,"the ""nicest"" coo in tech coming up  adambainissonice ",8,29,sports,0.136,2
1703,2016-02-11 03:59:31,"buncha softballs, i bet    ",2,13,business,0.136,3
1704,2016-02-11 03:57:23,so   what should i ask  tomorrow? ,8,30,sports,0.136,2
1705,2016-02-11 03:06:07,   studio 1 0 returns in march!',0,2,business,0.136,3
1706,2016-02-10 22:56:47,"bout to talk twitter, tesla live with    ",11,39,tech,0.136,4
1707,2016-02-10 22:21:40,"rt  twitter users flat down, sales to be lower than expected, lots of change to come   twtr'",8,0,business,0.136,3
1708,2016-02-10 22:21:21,"rt    ""2016 is definitely going to be a year of additions  my primary focus is on recruiting, and recruiting more to our  xe2 x80 xa6'",5,0,tech,0.136,4
1709,2016-02-10 21:29:35,monthly active users    excluding sms    actually declined to 305 million from 307 last q via ,1,7,tech,0.136,4
1710,2016-02-10 21:26:01,"twitter total maus 320m vs 324m estimated, revenue comes in in line via ",3,5,tech,0.136,4
1711,2016-02-10 04:19:14,"redditors    change is a coming! ceo steve huffman on revamping, monetization, harassment  ",6,14,tech,0.136,4
1712,2016-02-10 04:06:22, thanks   )',0,0,sports,0.136,2
1713,2016-02-10 04:01:13,"my full chat w  goldman 's gary cohn on unicorns, uber  amp  the ""massive re valuation"" in tech  ",24,50,business,0.136,3
1714,2016-02-09 22:03:42,what's keeping goldman sachs up at night  liquidity ,8,15,sports,0.136,2
1715,2016-02-09 21:56:57,"""we 've had to change""    goldman 's gary cohn on how they won back silicon valley ",9,14,sports,0.136,2
1716,2016-02-09 21:56:05,we're seeing a 'massive revaluation' in tech says goldman's gary cohn ,16,11,tech,0.136,4
1717,2016-02-09 21:54:53,goldman's gary cohn on hopes of winning uber's ipo  amp  pressure to go public  cc  ,15,19,business,0.136,3
1718,2016-02-09 20:09:57,about to go live with  steve huffman!  ,4,18,tech,0.136,4
1719,2016-02-09 19:37:17,"hanging w  goldman prez gary cohn! my chat w him on market bloodbath, uber and unicorns to come ",11,34,tech,0.136,4
1720,2016-02-09 19:02:41,coming up live with goldman coo and president now   ,5,6,tech,0.136,4
1721,2016-02-09 18:34:55,valuations a coming down      on the impact of public market turmoil ,5,9,business,0.136,3
1722,2016-02-09 17:54:07,"rt  coming up,  talks exclusively to  coo gary cohn  tune in at 2pm et  ",11,0,sports,0.136,2
1723,2016-02-09 17:50:03,rt  an increase in the share of women in top management from 0 to 30  is associated with a 15  rise in profitability n,13,0,business,0.136,3
1724,2016-02-09 17:49:01,"great point,     nothing is free, not even facebook free basics ",13,16,sports,0.136,2
1725,2016-02-06 01:26:14,"so excited for my girl,  and the great  students to speak at this! ",4,7,tech,0.136,4
1726,2016-02-06 01:23:22,after a bloody day for linkedin  amp  tableau    why the rest of tech is being dragged into it ,14,21,sports,0.136,2
1727,2016-02-06 01:22:18,all those people the jobs report didn't account for in silicon valley ,5,12,tech,0.136,4
1728,2016-02-05 21:37:54," i 'm working on a full show library   but meantime, best way is to google ""mark zuckerberg full show studio 1 0"" etc   '",0,1,tech,0.136,4
1729,2016-02-05 20:49:25, ,1,1,sports,0.136,2
1730,2016-02-05 20:48:13,   yep!',0,1,sports,0.136,2
1731,2016-02-05 16:51:06,rt   genetics may be best bet in fight against  zikavirus  explains    ,4,0,sports,0.136,2
1732,2016-02-05 16:50:54, 10 4',0,1,business,0.136,3
1733,2016-02-05 13:25:34,"rt  ok  jobs predictions    ceo 145k,  168k  172k  161k and cranky  no gue xe2 x80 xa6'",3,0,business,0.136,3
1734,2016-02-05 13:24:13,hanging on the go set with     ,2,25,sports,0.136,2
1735,2016-02-03 22:24:43,tpg co ceo jim coulter told me this today re  their reported interest in yahoo ,12,16,business,0.136,3
1736,2016-02-03 20:52:13,"rt  ""we had no money and were living in a remote part of the country, so we had to be scrappy!""  ",3,0,world,0.136,1
1737,2016-02-03 17:35:43,"""the college career network of the future""   congrats     ",10,10,sports,0.136,2
1738,2016-02-03 15:44:59,would marissa mayer view selling yahoo as a personal failure? my interview   ,55,58,tech,0.136,4
1739,2016-02-03 13:45:39,i'll be interviewing  on  momentarily    930aet  ,19,38,sports,0.136,2
1740,2016-02-02 22:30:13,"coming up    all about yahoo 's ""alternatives,"" alphabet vs apple msft fb,  amp   ceo mark hurd w   ",6,17,tech,0.136,4
1741,2016-02-02 20:35:46,"9 1 00    the last time tech accounted for 4 of the top 5 cos in the world  then, tech comprised 32  of the s amp p  today it's 17  via ",14,21,sports,0.136,2
1742,2016-02-01 21:09:03,alphabet shares already up 8  after hours on strong earnings   may well surpass apple in market cap by tomorrow am ',19,28,business,0.136,3
1743,2016-02-01 20:42:30,"due to our special coverage of the iowa caucuses,  will air at 8ppt 11pet today    full coverage of alphabet and more'",5,12,business,0.136,3
1744,2016-01-29 22:24:06,on star wars and new vr titles coming to  my chat with ceo andrew wilson ,4,6,tech,0.136,4
1745,2016-01-29 22:20:38,"wow   a year ago,  aapl had a  693b market cap,  goog  347b  today,  aapl    540b,  goog    516b, just  24b apart '",139,160,tech,0.136,4
1746,2016-01-29 21:54:51,"rt  couldn't be prouder of my man,  congrats on the awesome acknowledgement from the tech community! ",2,0,world,0.136,1
1747,2016-01-29 17:52:52,attention star wars gamers! my exclusive with  ceo andrew wilson up at 10apt 1pet  ,7,4,sports,0.136,2
1748,2016-01-28 19:22:48,rt  facebook's vp of marketing tells  what drove the company's monster quarter  ,23,0,business,0.136,3
1749,2016-01-28 18:02:16,i'll be interviewing facebook marketing vp david fischer exclusively 1030apt re  blockbuster quarter  ,13,34,tech,0.136,4
1750,2016-01-27 22:59:29,"breaking down facebook, paypal, ebay with    ",3,12,tech,0.136,4
1751,2016-01-27 18:25:39,"twitter should focus less not more on being mainstream, this analyst says  ",6,8,tech,0.136,4
1752,2016-01-26 21:55:05,"5) eu tax investigation could ""have material impact on our results if decision is negative"" but don 't know how big    apple cfo luca maestri'",8,14,tech,0.136,4
1753,2016-01-26 21:53:45,"4) ""we end up concluding our valuation is not correct, stock price doesn 't reflect the true value of our company""    apple cfo luca maestri'",6,19,tech,0.136,4
1754,2016-01-26 21:53:13,"3) but he points to huge services biz ""when you look at the amount of cash on our balance sheet, the size and growth of our services biz   ""'",3,14,tech,0.136,4
1755,2016-01-26 21:52:23,2) we have a very different macro environment from a year ago  there are a lot of countries in a recession    apple cfo luca maestri',4,13,tech,0.136,4
1756,2016-01-26 21:51:56,"1) apple cfo luca maestri tells us  in the first weeks of jan, we are seeing some level of economic softness xe2 x80 xa6not in mainland china but in hk'",2,16,business,0.136,3
1757,2016-01-26 04:29:35,what twitter can still be with    post departures    ,9,13,tech,0.136,4
1758,2016-01-25 22:58:42,about to talk twitter and other stuff w      ,7,22,tech,0.136,4
1759,2016-01-25 21:18:02,fascinating    why robots mean interest rates could go even lower in the future ,10,15,business,0.136,3
1760,2016-01-24 23:45:10,what to look for in apple earnings  via ,6,12,tech,0.136,4
1761,2016-01-23 00:10:44,   thank you!',0,1,tech,0.136,4
1762,2016-01-23 00:10:12, yes live',0,0,tech,0.136,4
1763,2016-01-23 00:09:56,can you come talk to my children? ,2,31,tech,0.136,4
1764,2016-01-22 15:46:19,rt  the smaller space company winning  support and giving  a run for his money   ,4,0,tech,0.136,4
1765,2016-01-22 15:45:24,rt  does a verizon takeover of yahoo make sense? with  and  on  ,2,0,tech,0.136,4
1766,2016-01-22 00:52:30,"rt  and then there were 9 planets again    maybe   explains the possible discovery of ""planet x"" ",4,0,tech,0.136,4
1767,2016-01-21 22:40:06,"loving today's show   on taking on musk bezos,    amp    3ppt""",1,11,business,0.136,3
1768,2016-01-21 19:01:29,rt  why doesn't silicon valley hire black coders? ,18,0,tech,0.136,4
1769,2016-01-20 22:48:44,"sorry guys,  pre empted today for special markets coverage live from asia cc ",0,11,business,0.136,3
1770,2016-01-20 21:04:58,"top tech stocks  aapl,  goog,  amzn,  fb have recovered  57b in market cap they lost at today's lows via ",4,9,business,0.136,3
1771,2016-01-20 20:39:24,u s  stocks trim losses in last hour of trading   nasdaq gains back nearly 4   via ,5,7,business,0.136,3
1772,2016-01-20 20:29:37,"rt   nasdaq biotech now up 4 1 , heads for best gain since oct  15'",9,0,business,0.136,3
1773,2016-01-20 17:01:39,"freelance coders getting paid 2x as much, up to  1000 hr ",13,28,business,0.136,3
1774,2016-01-20 16:10:10,"rt  counterintuitive, considering it 's underperformed, but tech may be the last ""safe haven"" propping up the s amp p 500 ",2,0,business,0.136,3
1775,2016-01-20 16:09:42,"yikes   very scary animation re  2015, the hottest year on record ",15,15,sports,0.136,2
1776,2016-01-19 19:25:32, off for mlk day but glad you missed us!',0,1,sports,0.136,2
1777,2016-01-19 19:25:15, off for mlk day sorry!',0,0,sports,0.136,2
1778,2016-01-19 19:25:07, were were off for mlk day  sorry!',0,1,sports,0.136,2
1779,2016-01-15 23:28:37,"    just so ya know, i got him to say it, but i had to say it 3x first '",1,2,sports,0.136,2
1780,2016-01-15 22:42:49,"uh oh, now i have to make you say it! ",3,21,tech,0.136,4
1781,2016-01-15 17:58:16,rt  inequality is inevitable  the vast inequality of america today isn xe2 x80 x99t  ,20,0,tech,0.136,4
1782,2016-01-15 17:57:13,"rt  morgan stanley's richest clients, who now have access to uber stock, aren't getting any info on uber's financials ",9,0,tech,0.136,4
1783,2016-01-15 05:29:51,"  launches new platform w  all candidates except, notably   ",19,44,tech,0.136,4
1784,2016-01-15 03:38:56,"why this analyst still thinks apple could really (yes, really) buy gopro ",2,10,tech,0.136,4
1785,2016-01-15 03:04:41, watch the video!',0,0,tech,0.136,4
1786,2016-01-15 03:04:19,2) my chat with indian car mogul  amp  scooter maker   ,16,41,business,0.136,3
1787,2016-01-15 02:57:44,"1) me riding a scooter for the first time, specifically the aspiring ""tesla of scooters""  ",7,43,sports,0.136,2
1788,2016-01-14 03:15:14,chatted w  oakland mayor  about the raiders today    her thoughts on whether they can strike a deal ,4,9,sports,0.136,2
1789,2016-01-13 21:18:31,"shoots, we just bought 20 tickets ",0,17,sports,0.136,2
1790,2016-01-13 03:26:14,rt  twitter's periscope is working on a technical solution to the harassment problem   said on  tv w  ,5,0,tech,0.136,4
1791,2016-01-13 02:42:03,"2) periscope also working on tools to monitor harassment, save videos  ",4,9,tech,0.136,4
1792,2016-01-13 02:39:25,1) on periscope's new integration w  twitter  amp   return   my chat with  ,4,10,business,0.136,3
1793,2016-01-13 00:10:03,can silicon valley save the american dream? great piece by my friend  ,8,16,sports,0.136,2
1794,2016-01-12 23:45:44,rt  watch now   talks to periscope's ceo  ,21,0,world,0.136,1
1795,2016-01-12 22:59:08,"coming up   ceo  on partnering w  white house, spotify,    amp   is baaaaaack!!!""",0,13,business,0.136,3
1796,2016-01-12 21:42:14,great chat w   who confirms they will start saving all periscopes very soon! full convo 3ppt  ,9,42,sports,0.136,2
1797,2016-01-12 21:08:36,live on  periscope  talking w    about new twitter integration and other stuff ,11,20,business,0.136,3
1798,2016-01-12 20:45:45,thanks for all the questions for  we'll be broadcasting the intvu live on  just after 1ppt  amp  later on ,4,13,sports,0.136,2
1799,2016-01-12 19:34:54,periscope ceo  is stopping by today    anything you want me to ask him???',0,18,tech,0.136,4
1800,2016-01-12 17:47:13,what former yahoo interim ceo tim morse would do if he was marissa mayer  ,2,9,sports,0.136,2
1801,2016-01-11 22:36:20,"rt  snapchat is gaining on facebook in mobile video views,   report  ",18,0,tech,0.136,4
1802,2016-01-11 21:59:16,"rt  at 6p et 3p pt  will be talking free falling tech stocks (etsy, fitbit, gopro) w    on ",1,0,business,0.136,3
1803,2016-01-11 21:47:03,so excited to honor   at the  gala  i'll be the emcee  info   ,4,18,sports,0.136,2
1804,2016-01-11 02:48:01,rt  whoa  nice face leo!  goldenglobes ,76,0,sports,0.136,2
1805,2016-01-11 02:34:29,what aaron sorkin told me about writing the steve jobs movie on studio 1 0 ,10,22,business,0.136,3
1806,2016-01-09 03:17:58,rt  see  interview today with  and  on  about  ,3,0,tech,0.136,4
1807,2016-01-09 01:18:27,"""cry in your own beer  there 's no boogie man coming for silicon valley says   ",9,20,tech,0.136,4
1808,2016-01-09 00:21:03,interesting debate re  uber pop in france     french economic minister shares his convos w   cc ,7,10,world,0.136,1
1809,2016-01-09 00:18:50,"tech companies shouldn't bow to the govt, weaken encryption    frmr homeland security secy  ",6,6,tech,0.136,4
1810,2016-01-09 00:15:06,inspired    discussing  ceo  amazing personal story today  ,8,35,tech,0.136,4
1811,2016-01-08 22:55:17,great show today   plus   frmr homeland security secy michael chertoff and guest host ,6,27,tech,0.136,4
1812,2016-01-08 22:16:22,"just spoke to    they say  new role not unlike larry page alphabet  he remains president, can now do more of everything""",4,15,tech,0.136,4
1813,2016-01-08 21:34:21,rt  twitter stock chart amid market downturn  another all time low    twtr ,25,0,business,0.136,3
1814,2016-01-08 18:17:03,"rt    plans to be up and running by 2021, ceo rob lloyd told  at  ces2016  ",16,0,tech,0.136,4
