,created_at,text,retweet_count,favorite_count,class_predict,followers_count,predict_class_label
4533,2016-06-13 21:21:58,"in our show today  apple w gene munster,  early siri investor gary morgenthaler, plus my chat with   amp   3ppt'",4,13,tech,0.136,4
4534,2016-06-13 21:18:54,"rt  scoop on msft linkedin  there was another bidder for linkedin, repped by goldman sachs  ",5,0,sports,0.136,2
4535,2016-06-13 18:08:50, pretty sure apple created that feature just for you and ,0,5,tech,0.136,4
4536,2016-06-13 17:57:33," it's all downhill from here """,0,2,sports,0.136,2
4537,2016-06-13 17:55:43,whoa  ,6,9,sports,0.136,2
4538,2016-06-13 17:44:16," only when we're winning, obvs """,0,2,sports,0.136,2
4539,2016-06-13 17:37:52,"ok, ok, macos with a lowercase ""m""    damn autocorrect'",5,15,sports,0.136,2
4540,2016-06-13 17:36:30,apple changing name of osx to macos    cheers!!! ,8,11,tech,0.136,4
4541,2016-06-13 17:36:06,"and tim cook kicks off by addressing orlando tragedy    ""unconscionable act of terrorism and hate"" ",13,33,world,0.136,1
4542,2016-06-13 17:32:43,rt  we must not let another mass shooting motivated by hatred go unanswered    orlandounited ,349,0,sports,0.136,2
4543,2016-06-13 17:29:57,4 sports screens on one tv coming to apple tv (thank goodness!)  wwdc2016 ,6,18,tech,0.136,4
4544,2016-06-13 16:33:36,why msft   linkedin and why now?   answer the  26 2b question  ,39,46,tech,0.136,4
4545,2016-06-13 05:42:13,so much fun  except i just realized   amp   have way better hair than me  thanks  ,94,524,tech,0.136,4
4546,2016-06-13 03:04:32,rt  reporting live from  tonight   and  ,15,0,tech,0.136,4
4547,2016-06-13 02:41:33,rt  back at it again   interviews erlich and richard this sunday  cc  ,149,0,sports,0.136,2
4548,2016-06-11 01:16:19,"the vision for     a new app for parents with google, twitter product vet   ",10,36,tech,0.136,4
4549,2016-06-10 20:21:54,"gawker has ruined quality of press, esp the      yesterday re  gawker, thiel  ",10,31,world,0.136,1
4550,2016-06-09 22:29:42,"fascinating chat w  about robots taking jobs, peter thiel vs   amp  hiring women  ",51,96,business,0.136,3
4551,2016-06-09 21:39:57,"rt  rip tom perkins, vc pioneer  n""thomas j  perkins, silicon valley venture capitalist, dies at 84"" ",39,0,sports,0.136,2
4552,2016-06-09 21:04:39,rt  jennifer lawrence will star in a movie about theranos  ,54,0,tech,0.136,4
4553,2016-06-09 14:17:10,rt  larry page and the coming age of flying cars     with t xe2 x80 xa6',31,0,tech,0.136,4
4554,2016-06-08 22:00:52,"rt  stopping by  to talk  and  internettrends with  tune in to today's show""",4,0,sports,0.136,2
4555,2016-06-08 20:50:08,"falling startup valuations help companies on m amp a, whitman says  via ",5,7,business,0.136,3
4556,2016-06-08 19:59:08,"rt  wow  meg openly criticized trump again, didn't say no to supporting hillary  nps didn't say no to selling hpe ",3,0,sports,0.136,2
4557,2016-06-08 19:40:16,"   on life post split, m amp a, valuations  plus will she endorse hillary?  ",12,20,business,0.136,3
4558,2016-06-08 18:09:56,coming up with   now  watch live  ,3,18,tech,0.136,4
4559,2016-06-07 22:56:51,rt  how verily's smart contact lens could revolutionize diabetes treatment  ,22,0,tech,0.136,4
4560,2016-06-07 20:12:51,"part 1 of my chat w  outgoing  president john hennessy on fundraising, admissions    more coming at 3ppt ",9,15,world,0.136,1
4561,2016-06-07 20:08:03,does stanford's president think a former student's 6 month sentence for rape is fair?  ,12,16,world,0.136,1
4562,2016-06-07 03:27:35,the fight for tech          on who's giving most to whom  ,9,7,tech,0.136,4
4563,2016-06-07 03:23:42,silicon valley is feeling the bern   but not the trump says    ,71,98,tech,0.136,4
4564,2016-06-07 03:20:13,still getting hate by the minute after this chat with   re  twitter harassment  ,14,23,sports,0.136,2
4565,2016-06-06 22:58:20,wow    just b c i talked to  and  on the show about harassment my feed is filled with hate (more than usual!)',7,28,tech,0.136,4
4566,2016-06-06 21:44:00,"also on today's show    ahead of the ca primary,    amp  verily's chief medical officer 3ppt""",4,8,business,0.136,3
4567,2016-06-06 20:42:33,"we'll be talking about online harassment horror stories with  and  on  3ppt""",4,18,tech,0.136,4
4568,2016-06-06 03:30:30,the great minds behind  new coding game for kids (seems pretty ingenious to me)  ,39,81,sports,0.136,2
4569,2016-06-06 03:27:04,this guy suing  tells me peter thiel isn't backing him  amp  yes he did invent e mail  ,20,24,sports,0.136,2
4570,2016-06-03 22:19:18,"the other guy suing gawker, dr  shiva ayyadurai coming up next  watch on  or live here  ",4,11,tech,0.136,4
4571,2016-06-03 20:41:56,rt    are you a tyrant?  you can xe2 x80 x99t make an omelet without breaking eggs  ,11,0,tech,0.136,4
4572,2016-06-03 20:40:30,"it was emotional, like getting married    what  told me about why he sold to google  ",18,44,tech,0.136,4
4573,2016-06-03 20:30:21,"rt  exclusive  interview with tony fadell, who's leaving nest ",4,0,world,0.136,1
4574,2016-06-03 20:13:24,"rt  breaking  tony fadell, founder of nest, is leaving google  ",121,0,tech,0.136,4
4575,2016-06-02 21:01:40,  a talented photographer indeed   ) such a fun trip',0,4,tech,0.136,4
4576,2016-06-02 04:10:50," hey it's also about being glad to be alive """,0,4,tech,0.136,4
4577,2016-06-01 23:09:41,so excited to have  on the team!!! ,2,30,sports,0.136,2
4578,2016-05-31 22:00:45,tesla co founder ian wright joining us now to talk about he shareholder meeting and more  ,7,22,business,0.136,3
4579,2016-05-31 21:02:53,"my chat w  grab ceo anthony tan re  taking on   amp  the global alliance w  didi, ola  ",12,22,business,0.136,3
4580,2016-05-31 20:58:15,"the shanghai based lip sync app taking the u s  by storm, fun chat with  ",1,5,tech,0.136,4
4581,2016-05-27 21:53:08,"rt  self driving car startup zoox seeking to raise up to  252m round, could hit  1b valuation, per filing  ",15,0,business,0.136,3
4582,2016-05-27 21:35:18,um what?? the bus that will drive over cars  ,25,56,world,0.136,1
4583,2016-05-27 17:54:24,"so excited for bloomberg tech conf w   yuri milner,    amp  more!  ",23,83,business,0.136,3
4584,2016-05-27 17:48:01,  studio 1 0 is back this fall',0,1,business,0.136,3
4585,2016-05-27 15:35:14,"rt  how big are those killer asteroids? a critic says nasa doesn xe2 x80 x99t know , via  ",3,0,tech,0.136,4
4586,2016-05-27 03:56:11,"frmr  yahoo coo dan rosensweig explains his role in helping dan gilbert's, talks marissa's legacy  via ",4,10,world,0.136,1
4587,2016-05-27 03:37:59, thanks   )',0,4,sports,0.136,2
4588,2016-05-26 23:36:20,"knowing what he knows now, would  have ""outed"" peter thiel? his answer  ",10,15,sports,0.136,2
4589,2016-05-26 21:27:37,    yes   3pmpt!',1,2,world,0.136,1
4590,2016-05-26 21:26:15,"the guy who wrote the original story ""outing"" peter thiel,  up next with   ",2,11,sports,0.136,2
4591,2016-05-26 21:24:42,"coming up    grab ceo anthony tan, the ""uber of southeast asia"" in town from singapore ",7,59,world,0.136,1
4592,2016-05-25 18:43:23,billionaire thiel bankrolls hogan xe2 x80 x99s case against gawker  via ,4,9,tech,0.136,4
4593,2016-05-24 19:54:47,rt  great segment on our emerging efforts in oncology by     asco16  earlydetec xe2 x80 xa6',10,0,tech,0.136,4
4594,2016-05-24 19:54:39,"rt  if you've got only one 45 minute block to watch a biz news show from last friday, make it  with me and ",3,0,sports,0.136,2
4595,2016-05-24 19:54:24,rt     interview with  after  emtechdigital conference  deeplearning  ,14,0,sports,0.136,2
4596,2016-05-24 15:50:32,"on the studio 1 0 podcast  ""silicon valley 's""      ",2,22,business,0.136,3
4597,2016-05-24 03:42:15, no spoilers!!!',0,0,sports,0.136,2
4598,2016-05-23 19:44:44,"rt  ""it 's not luck  it 's hard work and some happy coincidences along the way ""  on great entrepreneurs  ",52,0,tech,0.136,4
4599,2016-05-23 17:06:34,applied materials ceo gary dickerson talks to me about the explosion of oled ,9,18,world,0.136,1
4600,2016-05-23 17:04:04,"we followed an  shopper, spoke w ceo  re growth, whole foods, future  ",13,14,business,0.136,3
4601,2016-05-21 22:25:58,"   it's working on my phone too but i flagged to issue to our tech support  what kind of phone?""",0,0,tech,0.136,4
4602,2016-05-21 22:09:45,"   well that experience is clearly not amazing! just checked and it's working fine on my computer    """,0,0,tech,0.136,4
4603,2016-05-21 22:02:04,"rt  mi box is coming to the us w  a ""pretty amazing"" price, says  to  how amazing is amazing?  xf0 x9f x98 x81 ",33,0,business,0.136,3
4604,2016-05-21 01:11:45,"rt   we are not really doing anything to violate peoples' privacy and i apologize for the joke """,1,0,tech,0.136,4
4605,2016-05-21 00:29:38," right but should you have access to what i xe2 x80 x99m privately reading vs sharing? shouldn xe2 x80 x99t user data be anonymous, even to employees?'",1,13,tech,0.136,4
4606,2016-05-21 00:28:21,deep dive on  profitability with    ,8,20,tech,0.136,4
4607,2016-05-21 00:11:51,"rt   oops!  twitter, facebook  amp  google all know way more about you than we do, but i guess we are not supposed to admi xe2 x80 xa6'",2,0,tech,0.136,4
4608,2016-05-21 00:05:43,i love  but don't love that ceo  told me he knows everything i'm reading!  ,15,50,sports,0.136,2
4609,2016-05-20 21:18:41,"rt  i'll be on  with  from 3pm   4pm pst today  yay, live tv!""",4,0,tech,0.136,4
4610,2016-05-20 17:02:08,i told marissa mayer not to take the job    she should have taken my advice    with  ,3,11,sports,0.136,2
4611,2016-05-20 02:48:24,that time  stole my chair  amp  grilled me about watermelons   how you can get on tv  ,13,71,tech,0.136,4
4612,2016-05-19 22:10:39,live now!  ,5,11,tech,0.136,4
4613,2016-05-19 03:16:36,"the standalone  app stays    my chat w   re  fb live, ads, harassment  ",7,17,tech,0.136,4
4614,2016-05-19 03:12:37, founder  on facebook live vs  everyone else ,0,12,tech,0.136,4
4615,2016-05-19 03:09:46,"""valuations are going down""      on taking snapchat pitches  ",11,27,business,0.136,3
4616,2016-05-18 22:49:07,live on  periscope  interviewing  ceo  remotely! ,6,22,business,0.136,3
4617,2016-05-18 19:39:27,"fyi that last post was with alex zhu, ceo of  aka  helping me make my first video'",2,12,sports,0.136,2
4618,2016-05-18 19:37:09,this tweet from  has been withheld in response to a report from the copyright holder  learn more ',11,46,tech,0.136,4
4619,2016-05-18 18:55:06,rt  revolution's  speaks w  on  on the future of p2p lending amid the  lc scandal ,4,0,business,0.136,3
4620,2016-05-18 03:16:02,"microsoft chair john thompson on nadella, cloud, diversity  amp  advice for   ",21,27,business,0.136,3
4621,2016-05-17 16:51:33,rt  microsoft wants britain to vote against  brexit and stay in the eu  ,36,0,world,0.136,1
4622,2016-05-16 21:14:44,"peter thiel compares the ivy league to the medieval catholic church, this week   ",13,41,sports,0.136,2
4623,2016-05-16 15:59:56,icymi    my chat with   on the founder drama from last week  ,5,13,world,0.136,1
4624,2016-05-12 22:40:42,my guest host for the hour!  ,1,27,sports,0.136,2
4625,2016-05-12 22:19:39,"if the digital revolution is now, the bio revolution is next    mit    ",15,43,tech,0.136,4
4626,2016-05-11 21:50:46,rt  looking forward to seeing you   ,5,0,sports,0.136,2
4627,2016-05-11 21:48:17,we're live from the mit  talking about the future of the future  top of the hr!  ,7,35,tech,0.136,4
4628,2016-05-11 21:21:23,"the future of dynamic homes being designed here, 1 room 8 different ways ie  bed comes out of ceiling  ",14,36,tech,0.136,4
4629,2016-05-11 21:16:24,"the skirt on the left senses your emotions, gets longer if you feel threatened (say, in a bar) at the mit  ",21,53,sports,0.136,2
4630,2016-05-11 21:14:58,the clothes on these mannequins are made of bacteria    get thicker when it's cold and vice versa mit  ,23,44,tech,0.136,4
4631,2016-05-11 21:13:32,"diet robots, kids robots, elderly robots at the mit  ",3,10,tech,0.136,4
4632,2016-05-11 18:33:47,"boston 's ""moneyball"" mayor  on    amp    ",3,15,business,0.136,3
4633,2016-05-11 16:44:13,"we're live from the mit  today with  and a bunch of super cool ideas, companies, researchers ",20,48,tech,0.136,4
4634,2016-05-11 01:45:26,"  pretty sure we'd need a few daily to keep our home supplied and fed   )""",0,5,tech,0.136,4
4635,2016-05-11 01:43:05,drones will be delivering amazon to your doorstep by 2020    robotics founder   ,29,51,tech,0.136,4
4636,2016-05-11 01:38:37,the   on the latest founder drama  amp  what boston has on silicon valley  ,9,23,business,0.136,3
4637,2016-05-10 22:25:49,hanging with boston mayor marty walsh ,9,22,sports,0.136,2
4638,2016-05-10 20:41:26,  adorable!',0,2,sports,0.136,2
4639,2016-05-10 20:41:07,   aww thank you',0,2,tech,0.136,4
4640,2016-05-10 20:40:44,   great to meet you!',0,4,sports,0.136,2
4641,2016-05-10 20:37:51,   thanks for coming!!!',0,3,sports,0.136,2
4642,2016-05-10 20:36:38,"about to go live from the boston convention ctr    biotech, robots  amp  a sit down w  the mayor  ",4,35,business,0.136,3
4643,2016-05-10 16:24:11,can food for entire cities be grown in hi tech shipping containers? meet  ,19,25,tech,0.136,4
4644,2016-05-10 00:13:41,can harvard beat stanford at its own game? the new dean of the engineering school  ,13,24,sports,0.136,2
4645,2016-05-10 00:00:13,"a supersonic jet could someday get you from ny to london in 3 hrs, these guys are doing it  ",16,26,tech,0.136,4
4646,2016-05-09 23:54:45,"tech is in a ""funk""     on funding  amp  their bets on drones  amp  robots of the future  ",25,46,business,0.136,3
4647,2016-05-09 23:51:06,boston's push to develop  1b companies with    amp    ,20,19,business,0.136,3
4648,2016-05-09 21:27:59,live from boston with  and more at the top of the hour! stream here  ,5,34,sports,0.136,2
4649,2016-05-09 19:04:12,3d printing startup doing some modeling on the window sill at boston's district hall ,4,19,sports,0.136,2
4650,2016-05-09 19:03:25,our live set up at boston's district hall (startup co working space) in seaport district    new home of ge ,15,43,tech,0.136,4
4651,2016-05-09 16:56:14,my extended interview with ellen pao on the studio 1 0 podcast w    ,5,14,business,0.136,3
4652,2016-05-09 15:05:08,"we're live in boston this week covering the tech scene from  to startups, harvard to mit and supersonic rockets! ",21,78,sports,0.136,2
4653,2016-05-09 15:03:24,rt  i xe2 x80 x99m looking forward to joining  for bloomberg west tonight  and if you live in boston come on down! ,6,0,sports,0.136,2
4654,2016-05-06 03:48:24,"will harvard, stanford be around for centuries more? sal khan on the future of   amp  education ",23,37,tech,0.136,4
4655,2016-05-06 03:46:59,vox ceo  on doubling down on snapchat  amp  the future of media  cc ,14,18,business,0.136,3
4656,2016-05-05 22:28:39,up next  founder sal khan and  ceo jim bankoff  stream now  ,10,21,tech,0.136,4
4657,2016-05-05 19:00:50,rt  i had a great conversation yesterday with  thanks for coming out to oakland! ,6,0,sports,0.136,2
4658,2016-05-04 22:47:30,"rt  oculus has a new coo  shipping delays, meet a guy with supply chain experience  ",7,0,tech,0.136,4
4659,2016-05-04 16:52:01," ha, thank you   )'",0,1,tech,0.136,4
4660,2016-05-04 02:14:47,my full interview with ellen pao on life since the trial  amp  what's next  cc  ,10,60,business,0.136,3
4661,2016-05-03 23:21:00,"ellen pao  what she has to say to john doerr, her new book, and would she do it again?  ",3,13,sports,0.136,2
4662,2016-05-03 23:17:21,ellen pao on whether we're harder on women ceos ,2,10,world,0.136,1
4663,2016-05-03 23:15:10,ellen pao on why she left   amp  how to make it safer for women ,9,7,sports,0.136,2
4664,2016-05-03 22:49:16,"ellen pao on her next act, project include, life post trial  amp  her forthcoming book (part 1)  ",11,27,business,0.136,3
4665,2016-05-03 20:24:32,8 floors of cable across 2 streets never touching the ground    that's how  got ellen pao live ,6,44,tech,0.136,4
4666,2016-05-03 19:01:46,coming up live with ellen pao now! stream here     ,4,10,tech,0.136,4
4667,2016-05-03 16:16:08,i'll be interviewing ellen pao about her next act coming up cc   ,12,22,tech,0.136,4
4668,2016-05-02 21:54:11,"coming up  founder nolan bushnell,  troy carter,   amp   ",5,7,business,0.136,3
4669,2016-05-02 21:17:49,studio 1 0 post season! check out our    unicorn podcast w   cc  ,7,13,sports,0.136,2
4670,2016-05-01 21:31:19,just another night out in san francisco! cc  ,7,46,sports,0.136,2
4671,2016-05-01 04:01:26,just another night out in san francisco! cc  ,5,59,sports,0.136,2
4672,2016-04-29 21:38:18,"for some reason,  asked my advice on what it takes to be a tv reporter ",7,40,tech,0.136,4
4673,2016-04-29 21:21:43,"rt  jesus  sfpd texts include terms like ""hock gwai,"" a misppelled cantonese term for ""black devil"" ",5,0,sports,0.136,2
4674,2016-04-29 21:09:05," thank you! i'm surrounded by smart people""",0,0,tech,0.136,4
4675,2016-04-29 20:20:18,rt     on if the govt and silicon valley finding common ground     thir xe2 x80 xa6',9,0,tech,0.136,4
4676,2016-04-29 20:18:34,"my full chat w  on volatility, china, yahoo  amp  taking  to the next level  ",13,30,business,0.136,3
4677,2016-04-29 17:26:41,how does  take a maturing business to the next level?  ,5,11,business,0.136,3
4678,2016-04-29 17:25:03,why are  shares so volatile?  answer  ,4,6,business,0.136,3
4679,2016-04-29 16:30:19,"pandora ceo  on new on demand service, being ""louder,""  amp   ",13,13,business,0.136,3
4680,2016-04-29 14:43:10,jamming with reinstated pandora ceo  (he was last ceo when it was 40 ppl but never really left) ,6,61,sports,0.136,2
4681,2016-04-29 14:01:40,rt    shares surging 6   don't miss ceo  on  next   p ,4,0,business,0.136,3
4682,2016-04-29 13:36:50,"up next, i'm speaking with   on   ",13,18,world,0.136,1
4683,2016-04-28 22:37:41,"rt  jelly gives you real answers, not search results,  stone tells   ",20,0,tech,0.136,4
4684,2016-04-28 18:24:00,"""wall street thinks in quarters,  thinks in decades "" why  isn 't selling   ",7,28,business,0.136,3
4685,2016-04-28 18:21:47,why  is betting you'll go to  over google  ,5,5,tech,0.136,4
4686,2016-04-28 17:00:47,selfie time with  live now  cc     ,3,20,tech,0.136,4
4687,2016-04-28 14:01:12,"rt  sources  snapchat now has 10 billion daily video views, and 1 3 of daily users making snap stories ",12,0,tech,0.136,4
4688,2016-04-28 03:14:55,"   please, i can't handle all of this flattery """,1,3,tech,0.136,4
4689,2016-04-28 03:06:41,rt  tune in tomorrow for  conversation with twitter co founder  stone  ,8,0,business,0.136,3
4690,2016-04-28 03:06:28,"can  win in an over stuffed market?  on competition, valuation, lawsuits  ",5,18,tech,0.136,4
4691,2016-04-27 21:51:46,"coming up     facebook, yahoo and more! ",4,9,tech,0.136,4
4692,2016-04-26 17:24:59,"  raps earnings, says verizon yahoo bid reps what they 're ""running away from""  ",2,5,tech,0.136,4
4693,2016-04-26 16:43:25,"update  my twitter for mac app was hacked   has been v helpful  they're now trying to unfollow 1000  plus unwanted accts """,4,24,tech,0.136,4
4694,2016-04-26 16:16:57,  free the   !!! ,0,2,sports,0.136,2
4695,2016-04-26 15:30:41,rt  live on  periscope  t mobile ceo going on to bloomberg to talk to emily chang about earnings! ,13,0,business,0.136,3
4696,2016-04-25 16:32:22,still getting twitter dm spam    1  changed password 2  accepting dms from anyone is off  help!!!',5,18,tech,0.136,4
4697,2016-04-25 16:11:50, you can see why   )',0,1,tech,0.136,4
4698,2016-04-25 14:05:49,the extended (slightly torturous) cut ,2,19,business,0.136,3
4699,2016-04-25 14:01:43,pretty sure it's all downhill from here  rigby ,20,105,sports,0.136,2
4700,2016-04-22 22:34:55,  well he did say  is wanted by the authorities   )',0,4,world,0.136,1
4701,2016-04-22 22:32:08,rt  secureworks literally changed 0  on its first day of trading   ipo ,5,0,business,0.136,3
4702,2016-04-22 22:14:06,"yahoo got more than 10 bids, will narrow to 7 next wk, via  ",14,12,tech,0.136,4
4703,2016-04-22 16:51:14,"rt  watchlist 2016  they're not just a tech company, they are  hooli ",6,0,tech,0.136,4
4704,2016-04-22 01:44:46,view from  hq  not too shabby ,8,34,tech,0.136,4
4705,2016-04-22 00:22:57,plus  agrees w     amp  responds to  claim social media created trump  ,10,14,business,0.136,3
4706,2016-04-22 00:16:58,"""silicon valley 's""   with their season 3 secret weapon   ",9,17,sports,0.136,2
4707,2016-04-21 23:22:55,"didi 's new valuation is ""significantly higher"" than the  25b reported   says pres  jean liu  ",17,24,business,0.136,3
4708,2016-04-21 23:01:45,  ceo on taking over for  being profitable this yr  amp  diversity  ,20,37,business,0.136,3
4709,2016-04-21 22:36:01,rt  exclusive  didi chuxing president jean liu talks to   ,8,0,world,0.136,1
4710,2016-04-21 21:57:17,the power woman behind didi talks about on taking on uber    president jean liu up next! ,6,61,world,0.136,1
4711,2016-04-21 21:39:14,coming up next!    on the new season of  (tough life) ,19,84,sports,0.136,2
4712,2016-04-21 16:34:26,"i 've had ""accept dms from anyone"" turned off   and don 't follow any of the people who are sending them   '",1,10,world,0.136,1
4713,2016-04-21 16:25:17,anyone else suddenly getting a ton of spam twitter dms? how do i stop this?',3,5,tech,0.136,4
4714,2016-04-20 17:09:02,rt  the funny cuz it's true vid you must see  names  hand gestures ,128,0,tech,0.136,4
4715,2016-04-20 16:57:02,rt  google has plenty of reasons to be paranoid about android  ,7,0,tech,0.136,4
4716,2016-04-20 15:35:14,"android head hiroshi lockheimer told me back in feb he believes there 's ""confusion"" in eu about how ecosystem works ",0,3,sports,0.136,2
4717,2016-04-20 14:42:40,congressman  who called hearing yesterday not happy with apple's answers ,3,1,tech,0.136,4
4718,2016-04-19 20:04:08,"intel cutting up to 12,000 jobs or 11  of employees via ",17,8,business,0.136,3
4719,2016-04-19 15:45:56,"rt  the real inside story of the amazon flash     er, the amazon echo  by  ",9,0,tech,0.136,4
4720,2016-04-19 03:00:08,"the full studio 1 0 w   on verizon yahoo, sleep  amp  the delusion of silicon valley  ",12,29,business,0.136,3
4721,2016-04-19 02:50:16,"if bill campbell were here he 'd probably ""spit in disgust"" on this whole conversation   remembers ""coach"" ",9,15,sports,0.136,2
4722,2016-04-18 22:27:20,"theranos says it's under investigation by sec, us attorney, being asked to provide documents, says it's cooperating via ",13,17,business,0.136,3
4723,2016-04-18 15:37:11,the humans hiding behind the chatbots  by ,5,11,sports,0.136,2
4724,2016-04-18 15:02:51,"the ""macho delusion"" travis kalanick  amp  donald trump had in common,  on sleep  ",7,22,business,0.136,3
4725,2016-04-18 14:55:08,why  says she wants yahoo in the verizon family  amp  her thoughts on marissa mayer  ,14,18,business,0.136,3
4726,2016-04-17 15:33:33,"  up next! on sleep, trump, verizon yahoo  amp  future of media 9apt  ",7,38,tech,0.136,4
4727,2016-04-15 23:29:39,sneak peek of  on studio 1 0 this sunday  ,6,27,sports,0.136,2
4728,2016-04-15 17:46:04,"facebook cto  on executing the 10 year plan, hiring regina dugan  amp  personal sharing ",7,17,business,0.136,3
4729,2016-04-14 21:16:35,"   we'll make sure that doesn't happen again!""",0,3,sports,0.136,2
4730,2016-04-14 20:20:40,rt  studio 1 0     bill maris with   via   ,1,0,tech,0.136,4
4731,2016-04-13 22:15:55,"  on now talking fb sharing, theranos and more!  ",6,11,tech,0.136,4
4732,2016-04-13 19:48:29,going live with facebook cto  now! stream here   ,3,10,tech,0.136,4
4733,2016-04-13 17:30:59,interviewing facebook cto mike schroepfer shortly!!! ,4,22,sports,0.136,2
4734,2016-04-13 17:01:03,buckle up  ,3,13,business,0.136,3
4735,2016-04-13 04:31:20,    always write my own tweets',0,0,tech,0.136,4
4736,2016-04-13 03:05:33,the future of bots w   (just partnered w facebook)  amp      ,22,55,business,0.136,3
4737,2016-04-13 00:49:14,"  capital's  on risk, wall street  amp  the fate of yahoo  ",7,19,business,0.136,3
4738,2016-04-13 00:32:13,"rt  vc peter thiel says just about everything is overvalued, not just tech  via  ",8,0,tech,0.136,4
4739,2016-04-12 20:40:09,"""people have mischaracterized my views""    how peter thiel feels about college today  ",13,15,tech,0.136,4
4740,2016-04-12 19:39:58,peter thiel's reflections on china  so ferociously competitive it scares him  ,18,36,sports,0.136,2
4741,2016-04-12 19:20:54,"""we have a responsibilty""    peter thiel on the lack of women in vc and how we change it ",20,24,sports,0.136,2
4742,2016-04-12 19:18:05,"marissa is yahoo's best ceo since jerry yang, says peter thiel  amp  that's saying something  ",14,25,tech,0.136,4
4743,2016-04-12 19:14:01,"if there's a bubble, it's not in tech, it's everywhere, peter thiel tells me   lenditusa ",21,29,tech,0.136,4
4744,2016-04-12 19:11:31,"peter thiel on trump, sanders  amp  why he might ""blow his brains out"" if he was in politics  ",7,12,sports,0.136,2
4745,2016-04-12 16:45:07,selfie time with  from  on stage shortly  hi   lenditusa ,5,31,sports,0.136,2
4746,2016-04-12 16:00:00,about to sit down with   watch here    lenditusa ,7,22,world,0.136,1
4747,2016-04-12 14:32:49,i'll also be interviewing  capital's  at  catch her later today on  ,5,16,sports,0.136,2
4748,2016-04-12 14:31:03,speaking w  shortly at  watch  or stream here    lenditusa ,32,35,tech,0.136,4
4749,2016-04-12 01:46:09,what marissa mayer left on the table  amp  why tumblr was the wrong bet acc to   ,11,21,sports,0.136,2
4750,2016-04-12 00:14:33,where  disagrees with    why snapchat threatens us all n ,4,31,world,0.136,1
4751,2016-04-11 23:38:59,our full    unicorn special with    and   n ,7,28,tech,0.136,4
4752,2016-04-11 22:52:50,i'll be speaking with  at  tomorrow    tune in to  for the full intv ,14,60,sports,0.136,2
4753,2016-04-11 20:29:47, it was sked to run in uk at 2300gmt  amp  pan europe at 0000cet  was it not on? full show is online ,0,1,business,0.136,3
