,created_at,text,retweet_count,favorite_count,class_predict,followers_count,predict_class_label
3168,2015-05-07 23:04:55, 5 30ppt and 8 30ppt on  or stream here ,0,2,tech,0.136,4
3169,2015-05-07 23:03:57,my chat with     as candid as i've ever seen him    on studio 1 0 tonight!  ,10,33,sports,0.136,2
3170,2015-05-07 22:32:20,what apple retail star ron johnson thinks of how angela ahrendts is selling the watch ,3,6,tech,0.136,4
3171,2015-05-07 20:35:26,rt  alibaba's new ceo daniel zhang talks to  about what he'll do differently  ,6,0,business,0.136,3
3172,2015-05-07 20:34:09,rt  great moment   says daughter texted   xe2 x80 x98bad news  article says you xe2 x80 x99re 1 of 5 worst ceos  good news! you xe2 x80 x99re  5' ,3,0,tech,0.136,4
3173,2015-05-07 19:11:57,"how  feels about the people saying ""you suck  get off "" ",2,8,tech,0.136,4
3174,2015-05-07 17:08:53,who could buy yelp? thoughts?   ',1,1,business,0.136,3
3175,2015-05-07 16:26:04,"great show today  alibaba's new ceo daniel zhang, twitter's  former apple retail head ron johnson on  10apt""",2,13,business,0.136,3
3176,2015-05-07 14:08:19,new alibaba ceo daniel zhang tells me what he'll do differently from jonathan lu ,3,3,sports,0.136,2
3177,2015-05-07 13:54:11,good background on alibaba's new ceo by  ,3,6,business,0.136,3
3178,2015-05-07 13:46:25,"new alibaba ceo daniel zhang tells me comments about hiring freeze are overblown, international growth a ""long journey""'",5,0,business,0.136,3
3179,2015-05-07 12:29:15,"i'll be speaking with incoming alibaba ceo daniel zhang in about a half hour 9aet""",1,14,sports,0.136,2
3180,2015-05-06 23:04:05,goldman sachs is not competition     renaud laplanche ,1,4,tech,0.136,4
3181,2015-05-06 22:21:33, before  blog explains ,0,1,tech,0.136,4
3182,2015-05-06 22:21:10, you better  cheerio!',0,1,tech,0.136,4
3183,2015-05-06 22:20:21," you're starting to sound very british   )""",0,2,tech,0.136,4
3184,2015-05-06 22:06:43,season 2 of studio 1 0 starts tomorrow with  next up   amp  more  ,10,34,business,0.136,3
3185,2015-05-06 20:06:46,zynga plans to cut 18  of jobs via ,4,6,business,0.136,3
3186,2015-05-06 19:44:27,what kinda car will  ceo  buy with  500m? hint  not a ferrari  ,3,9,tech,0.136,4
3187,2015-05-06 18:13:32,"rt   ceo renaud laplanche tells  the ipo helped him build brand awareness, recruit employees and for xe2 x80 xa6'",7,0,business,0.136,3
3188,2015-05-06 16:00:47,season 2 of studio 1 0 is here! first up  then   amp  more     ,3,14,sports,0.136,2
3189,2015-05-05 22:06:44,"goodbye,  ""quite simply the person we all hoped to be   "" by me  amp   ",13,22,sports,0.136,2
3190,2015-05-04 22:29:10,our video tribute to  extraordinary co host among his many talents  ,14,30,tech,0.136,4
3191,2015-05-04 21:49:11,"wow, 30,000 sad faces on ",20,16,world,0.136,1
3192,2015-05-04 18:33:27," wow that may be he best compliment i've ever received   )""",0,0,sports,0.136,2
3193,2015-05-02 18:09:12,"  was one of the most genuine people i've ever met  we are all better for knowing him  my heart goes out to his family """,7,16,sports,0.136,2
3194,2015-05-01 20:15:41,rt  will have the latest on  in about 3 minutes on salesforce sap',3,0,tech,0.136,4
3195,2015-05-01 20:13:38,rt  talks of a deal stretch back to early 2014  sap said to have held strategy talks with salesforce last year ,3,0,world,0.136,1
3196,2015-05-01 20:13:14,salesforce was more recently approached by a company other than sap via ,2,4,tech,0.136,4
3197,2015-05-01 20:11:25,"""it couldn 't be determine whether there are currently any takeover discussions"" between salesforce and sap via ",2,5,tech,0.136,4
3198,2015-05-01 20:09:49,talks began after benioff called sap's bill mcdermott before sap earnings on 4 17 2014 via ,1,2,world,0.136,1
3199,2015-05-01 20:07:32,sap had acquisition talks with salesforce last year via ,6,6,business,0.136,3
3200,2015-04-30 21:27:37,linkedin has lost  7 9b in market cap in the last hour via ,21,14,business,0.136,3
3201,2015-04-30 17:45:43,rt  leaked  internal lyft document reveals the high cost of competing against uber  via  an xe2 x80 xa6',21,0,tech,0.136,4
3202,2015-04-30 04:27:39,"rt  got time on  today with  talking about q1 earnings, twitter doubts and where he goes from here  ",8,0,sports,0.136,2
3203,2015-04-29 22:15:24,just back from new zealand where i spoke with  at his mansion  catch it this season on studio 1 0 ,42,111,sports,0.136,2
3204,2015-04-27 01:24:55, thank you sara! studio 1 0 returns on may 7   )',0,2,business,0.136,3
3205,2015-04-27 01:23:59,   just no commercials',0,0,sports,0.136,2
3206,2015-04-27 00:45:08,my full interview with   amp    ,11,28,business,0.136,3
3207,2015-04-25 03:05:05,"before bruce jenner, watch sheryl sandberg  amp  richard branson 8 30ppt  or stream  ",5,11,business,0.136,3
3208,2015-04-25 01:41:12,"rt  richard branson blasts marissa mayer's work policies   grabs popcorn """,26,0,world,0.136,1
3209,2015-04-25 00:20:17,my interview with sheryl sandberg and richard branson on next on  of stream here ,5,17,world,0.136,1
3210,2015-04-25 00:05:18,watching bruce jenner tonight? turn on sheryl sandberg  amp  richard branson right before it 830pet pt on  ,2,7,sports,0.136,2
3211,2015-04-24 22:11:31,sheryl sandberg  ellen pao's experience all too common ,5,5,sports,0.136,2
3212,2015-04-24 20:05:14,"marissa mayer is on the wrong side of history, says richard branson re  work from home ",12,15,sports,0.136,2
3213,2015-04-24 19:04:45,"ellen pao, hillary clinton, facebook egg freezing    highlights from my chat w  sheryl sandberg  amp  richard branson ",6,9,business,0.136,3
3214,2015-04-24 17:05:19,richard branson  there won't be equality in the boardroom for at least 100 years ,5,6,sports,0.136,2
3215,2015-04-24 16:32:33,"by the way,  tells me she is not writing a new book ",5,28,sports,0.136,2
3216,2015-04-24 16:15:27,sheryl sandberg endorses  ,3,11,sports,0.136,2
3217,2015-04-24 16:13:50,  sorry to disappoint you but we are waiting just like (most) everyone else!',0,1,tech,0.136,4
3218,2015-04-24 16:11:24,  sorry to disappoint you but we are waiting just like almost everyone else',0,1,tech,0.136,4
3219,2015-04-24 16:10:27,"sheryl sandberg, richard branson defend facebook's egg freezing policy ",4,6,world,0.136,1
3220,2015-04-24 15:05:22,sheryl sandberg  women could have prevented the financial crisis ,5,4,world,0.136,1
3221,2015-04-24 14:30:10,  still waiting ',0,1,world,0.136,1
3222,2015-04-24 14:30:01,  in our 10apt 1pet show!',0,1,tech,0.136,4
3223,2015-04-24 14:13:06,about to interview  ,7,17,business,0.136,3
3224,2015-04-24 14:09:58,"sheryl sandberg  yes, women can have it all ",5,7,tech,0.136,4
3225,2015-04-24 14:09:24,"sheryl sandberg, richard branson defend facebook egg freezing policy  via'",6,7,world,0.136,1
3226,2015-04-24 13:05:17,sheryl sandberg  i saw myself in ellen pao ,5,8,business,0.136,3
3227,2015-04-24 12:35:39,sheryl sandberg tells me she wants to see hillary clinton in the white house ,4,3,sports,0.136,2
3228,2015-04-24 02:04:45,"rt  miss the debate or want to watch it back? you can do so here, in full    virgindisruptors'",24,0,sports,0.136,2
3229,2015-04-23 18:59:15,backstage w      stream live now  ,3,14,tech,0.136,4
3230,2015-04-23 18:34:56,just had an awesome convo with   amp   on work family life ,9,20,business,0.136,3
3231,2015-04-23 16:01:32,"i don't normally get this personal, but here goes     ",2,39,tech,0.136,4
3232,2015-04-23 15:20:07,then tomorrow my exclusive with   amp   on  about work family life ,6,14,business,0.136,3
3233,2015-04-23 15:15:23,my convo w       12ppt 3pet  stream here  ,10,7,sports,0.136,2
3234,2015-04-23 04:02:05,"9 11 could happen again, soon  frmr nsa head gen  keith alexander ",6,6,world,0.136,1
3235,2015-04-23 01:05:08,my balancing act    this is why i can't wait to talk to    tomorrow ,4,18,tech,0.136,4
3236,2019-02-06 16:22:08,"rt  lucid motors is ""currently in dialogue with companies that are interested in our technology xe2 x80 x9d according to a new bloomberg inte xe2 x80 xa6'",4,0,tech,0.136,4
3237,2019-02-05 23:27:25,"women make up 50  of the population, but only 17  of board seats at top companies  join me  amp  support  ",9,46,business,0.136,3
3238,2019-02-04 22:29:08,rt  container ship photo bomb behind  ,4,0,world,0.136,1
3239,2019-02-04 15:20:25, keep going! some tough pages but there are stories of inspiration too!',2,17,tech,0.136,4
3240,2019-02-03 17:39:57,"rt  check out my latest article in  diversity  it's not them, it's you  n n",29,0,tech,0.136,4
3241,2019-02-01 23:13:37,"  found lena! the ""first lady of the internet"" or as i wrote in brotopia ""tech 's original sin "" a beautiful s xe2 x80 xa6 ",25,68,tech,0.136,4
3242,2019-01-31 22:28:39,"rt  in two days, apple has knocked out some of the business operations of two of its biggest competitors at the flick of a swit xe2 x80 xa6'",107,0,tech,0.136,4
3243,2019-01-31 15:05:49,"rt  facebook needs ""to earn back people 's trust"" after ""challenging time,"" says sheryl sandberg  ",45,0,world,0.136,1
3244,2019-01-31 01:58:33,  ha! the photo makes us look a bit further apart than we were',0,1,business,0.136,3
3245,2019-01-31 01:15:27,"sheryl sandberg responds to research app controversy, being punished by apple and why anyone should trust facebook xe2 x80 xa6 ",29,99,tech,0.136,4
3246,2019-01-30 23:28:47,i xe2 x80 x99m live with sheryl sandberg now on  watch here   ,7,75,tech,0.136,4
3247,2019-01-30 21:49:11,"rt    tells  that americans ""get it"" that the rules are rigged to help the wealthy  watch live  xe2 x9e xa1 xef xb8 x8f ",15,0,tech,0.136,4
3248,2019-01-30 21:29:30,coming to you live from facebook headquarters shortly! show starts at the top of the hour followed by my sitdown wi xe2 x80 xa6 ,7,49,tech,0.136,4
3249,2019-01-30 18:02:41,i xe2 x80 x99ll be sitting down live with sheryl sandberg today after facebook reports  lots of important questions to ask  xe2 x80 xa6 ,27,158,tech,0.136,4
3250,2019-01-29 21:15:07,rt  breaking rules while breaking ground  powerhouse duo  of     of  will xe2 x80 xa6',18,0,tech,0.136,4
3251,2019-01-25 18:59:20,"rt  tfw you turn on bloombergtv from home after working there all day  proudly told my daughter, come watch this with me  ",4,0,sports,0.136,2
3252,2019-01-25 02:33:47,aaaand here xe2 x80 x99s the podcast version of my studio 1 0 sitdown with  co founders   ,10,58,tech,0.136,4
3253,2019-01-24 22:43:38,the full edition of bloomberg studio 1 0 with three of the founders of   xe2 x80 x94   ,22,80,tech,0.136,4
3254,2019-01-24 21:45:01,my sit down with priscilla chan and  of the sf foundation    why chan zuckerberg is backing a massiv xe2 x80 xa6 ,7,35,tech,0.136,4
3255,2019-01-24 20:07:16,the chan zuckerberg initiative is backing a massive  500m investment fund and  40m policy fund to fight the housing xe2 x80 xa6 ,13,93,business,0.136,3
3256,2019-01-23 17:17:33,so excited to have three of the women of  on bloomberg studio 1 0 tonight! catch    amp  xe2 x80 xa6 ,24,210,sports,0.136,2
3257,2019-01-23 03:37:24,"rt  have you checked out our   boardforward campaign yet? some amazing perks include a signed copy of  xe2 x81 xa6 book, xe2 x80 xa6'",4,0,tech,0.136,4
3258,2019-01-22 22:16:28,wow  oracle owes women and minorities  400m according to the department of labor ,268,684,business,0.136,3
3259,2019-01-22 19:41:24,rt  becoming by  brotopia by  (again  xf0 x9f x98 x8e)  amp  year of yes by  badass females writing badas xe2 x80 xa6',4,0,business,0.136,3
3260,2019-01-22 18:32:25, thank you!!! xf0 x9f x99 x8f',0,6,tech,0.136,4
3261,2019-01-17 17:08:12,this ai segment on  with  is worth a watch ,13,45,tech,0.136,4
3262,2019-01-16 21:57:37,rt  new story  apple is said to plan hiring reductions amid iphone woes   ,18,0,business,0.136,3
3263,2019-01-16 16:31:14,"as netflix raises prices, jeffrey katzenberg and meg whitman are betting you'll pay for a short form video service  xe2 x80 xa6 ",15,35,tech,0.136,4
3264,2019-01-15 19:58:55,lawyers suing google's board over massive payouts to andy rubin despite sexual misconduct claims explain why they t xe2 x80 xa6 ,6,12,tech,0.136,4
3265,2019-01-15 19:49:44,who xe2 x80 x99s to blame for the fires  xe2 x80 x94 pg amp e or climate change? and how well equipped is california to avoid future fires? r xe2 x80 xa6 ,7,20,tech,0.136,4
3266,2019-01-15 17:01:52,free agent alert!  is moving into vc    ,0,9,sports,0.136,2
3267,2019-01-14 20:21:00, are you talking about the light blue one?',0,1,tech,0.136,4
3268,2019-01-09 00:09:22,my chat with  ceo     on everything from ai and quantum computing to trump and trade  xe2 x80 xa6 ,9,41,tech,0.136,4
3269,2019-01-08 20:16:24,say wut??? ,16,55,world,0.136,1
3270,2019-01-08 19:43:48,live with ginni rometty now!! tune in    ,5,27,tech,0.136,4
3271,2019-01-08 19:26:16,"rt  funnily enough, my 1st office at cisco was in a telephone closet  i knew silicon valley was an unconventional place, but xe2 x80 xa6'",18,0,sports,0.136,2
3272,2019-01-08 18:19:35,"i mean, being included in this tweet is basically my dream come true  thank you   xf0 x9f x99 x8f ",3,79,tech,0.136,4
3273,2019-01-07 01:21:27,just sat down at the golden globes! and yes i got a selfie with   pinchme ,20,661,sports,0.136,2
3274,2019-01-05 00:56:26,rt  remember binary capital?  got served today   via twitter  ,6,0,world,0.136,1
3275,2019-01-03 22:04:04,our apple special live now   ,9,27,tech,0.136,4
3276,2019-01-03 19:06:17,great thread on the foreboding origin of the term  xe2 x80 x9cmeritocracy xe2 x80 x9d  xe2 x80 x94 and yes this guardian article on its history is w xe2 x80 xa6 ,8,26,tech,0.136,4
3277,2019-01-03 16:03:29,rt  breaking  trump economic adviser kevin hassett   xe2 x80 x9cthere are a heck of a lot of u s  companies that have sales in china that xe2 x80 xa6',19,0,business,0.136,3
3278,2018-12-21 18:27:37,rt  another eye opening finding in this report  the gender gap in artificial intelligence is three times larger than in other xe2 x80 xa6',142,0,business,0.136,3
3279,2018-12-20 17:54:20,this  is  amazing  now i love her even more  ,6,56,tech,0.136,4
3280,2018-12-20 16:35:12,     i have the pleasure of being married to him  thank you!  xf0 x9f x98 x89',1,4,sports,0.136,2
3281,2018-12-20 03:09:18,rt  watch  and i debate  on the latest facebook privacy news ,16,0,tech,0.136,4
3282,2018-12-19 18:30:50,"rt  ok facebook, but what does this mean?  nthere xe2 x80 x99s a big difference between something that narrowly allows me to send a song an xe2 x80 xa6'",51,0,tech,0.136,4
3283,2018-12-19 01:12:14,naacp president  explains why they returned a donation to facebook and shares his behind the scenes ph xe2 x80 xa6 ,20,46,world,0.136,1
3284,2018-12-18 23:39:43,qualcomm lawyer responds   and says apple needs to take the china iphone ban seriously   ,18,21,tech,0.136,4
3285,2018-12-18 18:08:52,the president of the   will be joining us on the show today to address their concerns about face xe2 x80 xa6 ,42,90,world,0.136,1
3286,2018-12-18 17:50:56,"rt  i dug into the dark realities that many women face driving for uber and lyft  harassment, assault and lower pay  story  amp  xe2 x80 xa6'",38,0,business,0.136,3
3287,2018-12-18 17:39:51, thanks! appreciate the comment too',0,0,sports,0.136,2
3288,2018-12-18 17:36:59,"thank you  also, if you're in a pinch, brotopia makes a great holiday gift and will arrive before chri xe2 x80 xa6 ",3,40,tech,0.136,4
3289,2018-12-18 16:53:43,"us brands are trying to bring as much merchandise into the country as possible before tariffs rise, can't keep trac xe2 x80 xa6 ",15,31,business,0.136,3
3290,2018-12-18 16:47:17,"uber seriously exploring ""full fledged grocery offering""    my chat with uber everything vp  about just how xe2 x80 xa6 ",8,22,tech,0.136,4
3291,2018-12-17 22:24:15,"china iphone ban ""not a blow,"" just part of qualcomm 's ""distraction"" and ""deception"" technique, says lawyer for app xe2 x80 xa6 ",7,16,world,0.136,1
3292,2018-12-17 22:17:16,rt  the great amzn echo shortage of '18? by   via ,8,0,tech,0.136,4
3293,2018-12-17 20:37:52,rt  the bloomberg businessweek 2018 jealousy list  all of the stories we wish we wrote this year ,15,0,sports,0.136,2
3294,2018-12-14 17:25:46, thank you!!!',0,4,tech,0.136,4
3295,2018-12-13 23:56:24,rt  scoop  medium ceo and twitter co founder ev williams has expressed interest in buying new york magazine and other media prope xe2 x80 xa6',108,0,business,0.136,3
3296,2018-12-13 21:05:12,talk about a sample size   has invested in 1900  companies to date    partners   ,9,44,tech,0.136,4
3297,2018-12-12 21:37:11,"rt  exclusive  employees at amazon's staten island nyc fulfillment center are going public with a unionization campaign, back xe2 x80 xa6""",752,0,tech,0.136,4
3298,2018-12-12 04:16:48,"house judiciary chair  tells me he still thinks google is biased, despite what sundar pichai had to s xe2 x80 xa6 ",8,17,tech,0.136,4
3299,2018-12-12 04:13:15,"""very disappointed""    rep   says google big tech will be a focus of the antitrust subcommittee when xe2 x80 xa6 ",6,19,tech,0.136,4
3300,2018-12-12 02:50:31,"rt  rep  cicilline, who xe2 x80 x99s taking reins of antitrust subcommittee next year, tells  that he's coming after tech next xe2 x80 xa6""",16,0,tech,0.136,4
3301,2018-12-11 21:44:04,at the top of the hour! ,3,11,sports,0.136,2
3302,2018-12-11 15:00:48,"rt  our curtain is raised, in  for sundar, ""the great conciliator,"" who will be tested in washington and in the plex  ",6,0,sports,0.136,2
3303,2018-12-11 04:55:42,"rt  tuesday on  full coverage of google ceo sundar pichai testifying before congress  after the hearing, ",3,0,business,0.136,3
3304,2018-12-11 00:34:32,"   given that it xe2 x80 x99s a pretty common name, i am pretty flattered!!'",0,0,tech,0.136,4
3305,2018-12-10 22:59:48,"  is set to surpass  100 million in revenue this year and sold one tube of ""boy brow"" every 4 seconds over xe2 x80 xa6 ",24,149,business,0.136,3
3306,2018-12-10 20:25:31,coming up today   founder  xe2 x81 xa6 shares some big news about growth in 2018  and yes the bonus is i xe2 x80 xa6 ,10,167,business,0.136,3
3307,2018-12-07 18:43:24,"facebook, instagram and whatsapp should (maybe) be three separate companies    says former fb product head xe2 x80 xa6 ",16,41,tech,0.136,4
3308,2018-12-06 16:11:52,rt  good morning  lyft filed confidentially to go public ,35,0,business,0.136,3
3309,2018-12-04 22:11:22,"""facebook is going to ruin instagram much faster than they ruined facebook""    a wide ranging convo with  who ne xe2 x80 xa6 ",37,87,tech,0.136,4
3310,2018-12-04 17:37:08,rt  facebook took down (and later restored) a post by a former employee saying he was concerned about discrimination at the com xe2 x80 xa6',22,0,world,0.136,1
3311,2018-12-03 21:42:47,"note  our show is being pre empted today due to continuing coverage of george h w  bush's passing  but you'll see us at 8ppt as usual """,2,21,tech,0.136,4
3312,2018-12-03 20:58:33,"rt  good job, everyone  this will fix everything  ",42,0,business,0.136,3
3313,2018-12-03 20:58:11,"rt  so i'm working on my book about instagram  nit's the story of the product, but also its cultural impact  culture is such a b xe2 x80 xa6""",47,0,tech,0.136,4
3314,2018-12-02 00:19:09, i was only blinded by the sight of a pulitzer prize winning journalist  xf0 x9f x91 x8f xf0 x9f x91 x8f xf0 x9f x91 x8f',1,6,sports,0.136,2
3315,2018-12-01 23:56:46, thank you!!!',0,1,tech,0.136,4
3316,2018-12-01 23:05:53,honored to share the stage with   at   knowyourvalue conference for an important c xe2 x80 xa6 ,10,60,sports,0.136,2
3317,2018-11-30 22:11:14,jiwoo lee was 14 when she used gene editing to kill cancer  now she's 19 and weighing in on the first gene edited b xe2 x80 xa6 ,39,89,sports,0.136,2
3318,2018-11-30 19:56:44,    total snoozer',0,4,tech,0.136,4
3319,2018-11-29 20:38:45,"rt  amazon conducted its hq2 search process like ""a hunger games of cities against each other for the benefit of the world xe2 x80 x99s ri xe2 x80 xa6'",14,0,tech,0.136,4
3320,2018-11-29 19:51:56,riley morrison  xe2 x80 x94 you go girl! this is how change happens ,9,75,tech,0.136,4
3321,2018-11-29 19:35:21,"if you xe2 x80 x99re looking for a career change, this looks like a pretty good option!  xe2 x81 xa6 climbs snow topped mountain xe2 x80 xa6 ",10,38,sports,0.136,2
3322,2018-11-29 18:40:54,thank you   i xe2 x80 x99m so encouraged by the brave folks who xe2 x80 x99ve picked up the torch and are continuing to push for change  xf0 x9f x94 xa5 xe2 x80 xa6 ,3,34,tech,0.136,4
3323,2018-11-29 04:07:33, xe2 x80 x9cthere xe2 x80 x99s a disparity between the people close to mark and his team and employees at the ground level   i didn xe2 x80 x99t wan xe2 x80 xa6 ,13,39,sports,0.136,2
3324,2018-11-28 23:43:19,"rt  listen to  interview with  about the struggles of being black at facebook  he doesn't sound like xe2 x80 xa6""",20,0,sports,0.136,2
3325,2018-11-27 15:11:59,"if you do one thing today, listen to this podcast  xe2 x80 x94 not sure what is more shocking, five women warehouse workers wh xe2 x80 xa6 ",139,229,sports,0.136,2
3326,2018-11-21 16:32:27,"rt  investors just don't want to see the warning signs   nmaybe this time will be different?  n nfoxconn sounds the alarm, and it's a xe2 x80 xa6""",18,0,tech,0.136,4
3327,2018-11-20 22:46:48," it's not at all like that, but this did make me laugh  a little """,0,4,sports,0.136,2
3328,2018-11-20 21:12:38,"so, i got really sick one day and  generously agreed to fill in for me on studio 1 0  he even broke some xe2 x80 xa6 ",9,38,sports,0.136,2
3329,2018-11-20 20:32:09,no  no  noooo  ,22,60,sports,0.136,2
3330,2018-11-20 18:12:24,rt  tesla presented the buffalo operation as a sequel to the gigafactory  but large portions resemble an empty walmart supercent xe2 x80 xa6',14,0,world,0.136,1
3331,2018-11-18 16:52:45,  thank you  wonder if we will  ever  find out where the fake report came from    ',0,2,tech,0.136,4
3332,2018-11-16 04:22:17,"rt  sheryl sandberg speaks, says nyt reports that she  xe2 x80 x9cpersonally stood in the way xe2 x80 x9d of the public knowing more about russia on xe2 x80 xa6'",19,0,world,0.136,1
3333,2018-11-15 23:43:47,"rt  uber 's  tells  that he doesn 't see any ""existential"" legal threats remaining for uber    but he won xe2 x80 xa6'",7,0,sports,0.136,2
3334,2018-11-15 23:28:00,"uber 's chief legal officer  says they 're ""definitely"" considering ending forced arbitration for discrimina xe2 x80 xa6 ",4,10,business,0.136,3
3335,2018-11-15 23:18:15,"""relentless""    the co founder of siri  says steve jobs called him 37 days in a row, and at midnight, to get t xe2 x80 xa6 ",13,30,business,0.136,3
3336,2018-11-15 18:35:20,coming up! our exclusive with  chief legal officer   xe2 x80 x94  2ppt ,3,12,tech,0.136,4
3337,2018-11-14 20:53:40,rt  a bot now tells financial times reporters if they xe2 x80 x99re only quoting men ,162,0,sports,0.136,2
3338,2018-11-13 16:55:13,"jeff bezos will be spending a lot of time at both new headquarters says amazon svp jay carney, and pushes back on c xe2 x80 xa6 ",12,37,sports,0.136,2
3339,2018-11-09 20:20:29, you just blew my mind!',0,6,tech,0.136,4
3340,2018-11-09 20:03:35,"you could never recreate me in ai!!! um, right?? ",37,196,sports,0.136,2
3341,2018-11-09 19:05:08,incoming    xe2 x80 x94 will scooters be the next segway or the next uber?? what happens in the winter? and in xe2 x80 xa6 ,12,38,sports,0.136,2
3342,2018-11-09 03:29:56,"rt  the google ""c suite seems paralyzed, caught between whatever fallout will come with proceeding in china and the costs of ign xe2 x80 xa6'",25,0,tech,0.136,4
3343,2018-11-09 03:26:09,rt  here xe2 x80 x99s the full maxine waters interview link   deutche n  wells n  cfpb   mick mulvaney n  fed n  hou xe2 x80 xa6',10,0,sports,0.136,2
3344,2018-11-08 23:24:36, another new word! by this you mean we xe2 x80 x99re going backwards?',0,3,tech,0.136,4
3345,2018-11-08 23:23:46,"rt  last week, 20,000 googlers staged a walkout to demand a more equitable workplace   n nthis week, google agrees to some (although xe2 x80 xa6'",420,0,business,0.136,3
3346,2018-11-07 04:09:36,rt  update from facebook  company tells me it had to enforce its now stronger policy against voter suppression via misinformati xe2 x80 xa6',29,0,tech,0.136,4
3347,2018-11-07 04:08:05,rt  big night for women  ,172,0,sports,0.136,2
3348,2018-11-05 22:24:09,"what will  newly approved drug response test look like?  weighs in on the promise, and the cont xe2 x80 xa6 ",1,9,business,0.136,3
3349,2018-11-05 22:15:21,"facebook 's crisis is just a ""little bump in the road""    my chat with billionaire investor  about social xe2 x80 xa6 ",2,9,business,0.136,3
3350,2018-11-05 21:43:56,"my colleagues are updating this super cool live blog focused on tech related updates to the midterms, from cyber to xe2 x80 xa6 ",8,20,tech,0.136,4
3351,2018-11-05 01:03:42,at the 7th annual  awards with  aka the  xe2 x80 x9coscars of science xe2 x80 x9d  xe2 x80 x94 and nearly my 7th time int xe2 x80 xa6 ,6,88,sports,0.136,2
3352,2018-10-31 22:17:20,"marc  makes the case for prop c    calls it a ""crisis of inequality,"" says  and  can afford i xe2 x80 xa6 ",30,98,tech,0.136,4
3353,2018-10-31 19:03:43,"marc  in the house, talking prop c on  ",8,107,world,0.136,1
3354,2018-10-26 20:36:59,"progress isn't just slow, it's stalled  breaking down the latest women in the workplace report with  ",6,29,tech,0.136,4
3355,2018-10-26 03:11:39,rt  great interview between  and  the part where katrina gives credit to  for helping ,13,0,tech,0.136,4
3356,2018-10-25 23:00:40,google engineer  speaks out    how employees are reacting to the  bombshell that google paid  90 xe2 x80 xa6 ,49,175,tech,0.136,4
3357,2018-10-25 22:53:26,the full edition of studio 1 0 with  ceo   if you're on the go    her xe2 x80 xa6 ,7,41,sports,0.136,2
3358,2018-10-25 22:46:32,"our chat with twitter cfo     on earnings, the status of the clean up and of course, the president xe2 x80 xa6 ",1,14,business,0.136,3
3359,2018-10-25 21:22:37, coming up right now on  to talk about   scoop ,1,13,sports,0.136,2
