,created_at,text,retweet_count,favorite_count,class_predict,followers_count,predict_class_label
0,2019-02-06 16:22:08,"rt  lucid motors is ""currently in dialogue with companies that are interested in our technology xe2 x80 x9d according to a new bloomberg inte xe2 x80 xa6'",4,0,tech,0.136,4
1,2019-02-05 23:27:25,"women make up 50  of the population, but only 17  of board seats at top companies  join me  amp  support  ",9,46,business,0.136,3
2,2019-02-04 22:29:08,rt  container ship photo bomb behind  ,4,0,world,0.136,1
3,2019-02-04 15:20:25, keep going! some tough pages but there are stories of inspiration too!',2,17,tech,0.136,4
4,2019-02-03 17:39:57,"rt  check out my latest article in  diversity  it's not them, it's you  n n",29,0,tech,0.136,4
5,2019-02-01 23:13:37,"  found lena! the ""first lady of the internet"" or as i wrote in brotopia ""tech 's original sin "" a beautiful s xe2 x80 xa6 ",25,68,tech,0.136,4
6,2019-01-31 22:28:39,"rt  in two days, apple has knocked out some of the business operations of two of its biggest competitors at the flick of a swit xe2 x80 xa6'",107,0,tech,0.136,4
7,2019-01-31 15:05:49,"rt  facebook needs ""to earn back people 's trust"" after ""challenging time,"" says sheryl sandberg  ",45,0,world,0.136,1
8,2019-01-31 01:58:33,  ha! the photo makes us look a bit further apart than we were',0,1,business,0.136,3
9,2019-01-31 01:15:27,"sheryl sandberg responds to research app controversy, being punished by apple and why anyone should trust facebook xe2 x80 xa6 ",29,99,tech,0.136,4
10,2019-01-30 23:28:47,i xe2 x80 x99m live with sheryl sandberg now on  watch here   ,7,75,tech,0.136,4
11,2019-01-30 21:49:11,"rt    tells  that americans ""get it"" that the rules are rigged to help the wealthy  watch live  xe2 x9e xa1 xef xb8 x8f ",15,0,tech,0.136,4
12,2019-01-30 21:29:30,coming to you live from facebook headquarters shortly! show starts at the top of the hour followed by my sitdown wi xe2 x80 xa6 ,7,49,tech,0.136,4
13,2019-01-30 18:02:41,i xe2 x80 x99ll be sitting down live with sheryl sandberg today after facebook reports  lots of important questions to ask  xe2 x80 xa6 ,27,158,tech,0.136,4
14,2019-01-29 21:15:07,rt  breaking rules while breaking ground  powerhouse duo  of     of  will xe2 x80 xa6',18,0,tech,0.136,4
15,2019-01-25 18:59:20,"rt  tfw you turn on bloombergtv from home after working there all day  proudly told my daughter, come watch this with me  ",4,0,sports,0.136,2
16,2019-01-25 02:33:47,aaaand here xe2 x80 x99s the podcast version of my studio 1 0 sitdown with  co founders   ,10,58,tech,0.136,4
17,2019-01-24 22:43:38,the full edition of bloomberg studio 1 0 with three of the founders of   xe2 x80 x94   ,22,80,tech,0.136,4
18,2019-01-24 21:45:01,my sit down with priscilla chan and  of the sf foundation    why chan zuckerberg is backing a massiv xe2 x80 xa6 ,7,35,tech,0.136,4
19,2019-01-24 20:07:16,the chan zuckerberg initiative is backing a massive  500m investment fund and  40m policy fund to fight the housing xe2 x80 xa6 ,13,93,business,0.136,3
20,2019-01-23 17:17:33,so excited to have three of the women of  on bloomberg studio 1 0 tonight! catch    amp  xe2 x80 xa6 ,24,210,sports,0.136,2
21,2019-01-23 03:37:24,"rt  have you checked out our   boardforward campaign yet? some amazing perks include a signed copy of  xe2 x81 xa6 book, xe2 x80 xa6'",4,0,tech,0.136,4
22,2019-01-22 22:16:28,wow  oracle owes women and minorities  400m according to the department of labor ,268,684,business,0.136,3
23,2019-01-22 19:41:24,rt  becoming by  brotopia by  (again  xf0 x9f x98 x8e)  amp  year of yes by  badass females writing badas xe2 x80 xa6',4,0,business,0.136,3
24,2019-01-22 18:32:25, thank you!!! xf0 x9f x99 x8f',0,6,tech,0.136,4
25,2019-01-17 17:08:12,this ai segment on  with  is worth a watch ,13,45,tech,0.136,4
26,2019-01-16 21:57:37,rt  new story  apple is said to plan hiring reductions amid iphone woes   ,18,0,business,0.136,3
27,2019-01-16 16:31:14,"as netflix raises prices, jeffrey katzenberg and meg whitman are betting you'll pay for a short form video service  xe2 x80 xa6 ",15,35,tech,0.136,4
28,2019-01-15 19:58:55,lawyers suing google's board over massive payouts to andy rubin despite sexual misconduct claims explain why they t xe2 x80 xa6 ,6,12,tech,0.136,4
29,2019-01-15 19:49:44,who xe2 x80 x99s to blame for the fires  xe2 x80 x94 pg amp e or climate change? and how well equipped is california to avoid future fires? r xe2 x80 xa6 ,7,20,tech,0.136,4
30,2019-01-15 17:01:52,free agent alert!  is moving into vc    ,0,9,sports,0.136,2
31,2019-01-14 20:21:00, are you talking about the light blue one?',0,1,tech,0.136,4
32,2019-01-09 00:09:22,my chat with  ceo     on everything from ai and quantum computing to trump and trade  xe2 x80 xa6 ,9,41,tech,0.136,4
33,2019-01-08 20:16:24,say wut??? ,16,55,world,0.136,1
34,2019-01-08 19:43:48,live with ginni rometty now!! tune in    ,5,27,tech,0.136,4
35,2019-01-08 19:26:16,"rt  funnily enough, my 1st office at cisco was in a telephone closet  i knew silicon valley was an unconventional place, but xe2 x80 xa6'",18,0,sports,0.136,2
36,2019-01-08 18:19:35,"i mean, being included in this tweet is basically my dream come true  thank you   xf0 x9f x99 x8f ",3,79,tech,0.136,4
37,2019-01-07 01:21:27,just sat down at the golden globes! and yes i got a selfie with   pinchme ,20,661,sports,0.136,2
38,2019-01-05 00:56:26,rt  remember binary capital?  got served today   via twitter  ,6,0,world,0.136,1
39,2019-01-03 22:04:04,our apple special live now   ,9,27,tech,0.136,4
40,2019-01-03 19:06:17,great thread on the foreboding origin of the term  xe2 x80 x9cmeritocracy xe2 x80 x9d  xe2 x80 x94 and yes this guardian article on its history is w xe2 x80 xa6 ,8,26,tech,0.136,4
41,2019-01-03 16:03:29,rt  breaking  trump economic adviser kevin hassett   xe2 x80 x9cthere are a heck of a lot of u s  companies that have sales in china that xe2 x80 xa6',19,0,business,0.136,3
42,2018-12-21 18:27:37,rt  another eye opening finding in this report  the gender gap in artificial intelligence is three times larger than in other xe2 x80 xa6',142,0,business,0.136,3
43,2018-12-20 17:54:20,this  is  amazing  now i love her even more  ,6,56,tech,0.136,4
44,2018-12-20 16:35:12,     i have the pleasure of being married to him  thank you!  xf0 x9f x98 x89',1,4,sports,0.136,2
45,2018-12-20 03:09:18,rt  watch  and i debate  on the latest facebook privacy news ,16,0,tech,0.136,4
46,2018-12-19 18:30:50,"rt  ok facebook, but what does this mean?  nthere xe2 x80 x99s a big difference between something that narrowly allows me to send a song an xe2 x80 xa6'",51,0,tech,0.136,4
47,2018-12-19 01:12:14,naacp president  explains why they returned a donation to facebook and shares his behind the scenes ph xe2 x80 xa6 ,20,46,world,0.136,1
48,2018-12-18 23:39:43,qualcomm lawyer responds   and says apple needs to take the china iphone ban seriously   ,18,21,tech,0.136,4
49,2018-12-18 18:08:52,the president of the   will be joining us on the show today to address their concerns about face xe2 x80 xa6 ,42,90,world,0.136,1
50,2018-12-18 17:50:56,"rt  i dug into the dark realities that many women face driving for uber and lyft  harassment, assault and lower pay  story  amp  xe2 x80 xa6'",38,0,business,0.136,3
51,2018-12-18 17:39:51, thanks! appreciate the comment too',0,0,sports,0.136,2
52,2018-12-18 17:36:59,"thank you  also, if you're in a pinch, brotopia makes a great holiday gift and will arrive before chri xe2 x80 xa6 ",3,40,tech,0.136,4
53,2018-12-18 16:53:43,"us brands are trying to bring as much merchandise into the country as possible before tariffs rise, can't keep trac xe2 x80 xa6 ",15,31,business,0.136,3
54,2018-12-18 16:47:17,"uber seriously exploring ""full fledged grocery offering""    my chat with uber everything vp  about just how xe2 x80 xa6 ",8,22,tech,0.136,4
55,2018-12-17 22:24:15,"china iphone ban ""not a blow,"" just part of qualcomm 's ""distraction"" and ""deception"" technique, says lawyer for app xe2 x80 xa6 ",7,16,world,0.136,1
56,2018-12-17 22:17:16,rt  the great amzn echo shortage of '18? by   via ,8,0,tech,0.136,4
57,2018-12-17 20:37:52,rt  the bloomberg businessweek 2018 jealousy list  all of the stories we wish we wrote this year ,15,0,sports,0.136,2
58,2018-12-14 17:25:46, thank you!!!',0,4,tech,0.136,4
59,2018-12-13 23:56:24,rt  scoop  medium ceo and twitter co founder ev williams has expressed interest in buying new york magazine and other media prope xe2 x80 xa6',108,0,business,0.136,3
60,2018-12-13 21:05:12,talk about a sample size   has invested in 1900  companies to date    partners   ,9,44,tech,0.136,4
61,2018-12-12 21:37:11,"rt  exclusive  employees at amazon's staten island nyc fulfillment center are going public with a unionization campaign, back xe2 x80 xa6""",752,0,tech,0.136,4
62,2018-12-12 04:16:48,"house judiciary chair  tells me he still thinks google is biased, despite what sundar pichai had to s xe2 x80 xa6 ",8,17,tech,0.136,4
63,2018-12-12 04:13:15,"""very disappointed""    rep   says google big tech will be a focus of the antitrust subcommittee when xe2 x80 xa6 ",6,19,tech,0.136,4
64,2018-12-12 02:50:31,"rt  rep  cicilline, who xe2 x80 x99s taking reins of antitrust subcommittee next year, tells  that he's coming after tech next xe2 x80 xa6""",16,0,tech,0.136,4
65,2018-12-11 21:44:04,at the top of the hour! ,3,11,sports,0.136,2
66,2018-12-11 15:00:48,"rt  our curtain is raised, in  for sundar, ""the great conciliator,"" who will be tested in washington and in the plex  ",6,0,sports,0.136,2
67,2018-12-11 04:55:42,"rt  tuesday on  full coverage of google ceo sundar pichai testifying before congress  after the hearing, ",3,0,business,0.136,3
68,2018-12-11 00:34:32,"   given that it xe2 x80 x99s a pretty common name, i am pretty flattered!!'",0,0,tech,0.136,4
69,2018-12-10 22:59:48,"  is set to surpass  100 million in revenue this year and sold one tube of ""boy brow"" every 4 seconds over xe2 x80 xa6 ",24,149,business,0.136,3
70,2018-12-10 20:25:31,coming up today   founder  xe2 x81 xa6 shares some big news about growth in 2018  and yes the bonus is i xe2 x80 xa6 ,10,167,business,0.136,3
71,2018-12-07 18:43:24,"facebook, instagram and whatsapp should (maybe) be three separate companies    says former fb product head xe2 x80 xa6 ",16,41,tech,0.136,4
72,2018-12-06 16:11:52,rt  good morning  lyft filed confidentially to go public ,35,0,business,0.136,3
73,2018-12-04 22:11:22,"""facebook is going to ruin instagram much faster than they ruined facebook""    a wide ranging convo with  who ne xe2 x80 xa6 ",37,87,tech,0.136,4
74,2018-12-04 17:37:08,rt  facebook took down (and later restored) a post by a former employee saying he was concerned about discrimination at the com xe2 x80 xa6',22,0,world,0.136,1
75,2018-12-03 21:42:47,"note  our show is being pre empted today due to continuing coverage of george h w  bush's passing  but you'll see us at 8ppt as usual """,2,21,tech,0.136,4
76,2018-12-03 20:58:33,"rt  good job, everyone  this will fix everything  ",42,0,business,0.136,3
77,2018-12-03 20:58:11,"rt  so i'm working on my book about instagram  nit's the story of the product, but also its cultural impact  culture is such a b xe2 x80 xa6""",47,0,tech,0.136,4
78,2018-12-02 00:19:09, i was only blinded by the sight of a pulitzer prize winning journalist  xf0 x9f x91 x8f xf0 x9f x91 x8f xf0 x9f x91 x8f',1,6,sports,0.136,2
79,2018-12-01 23:56:46, thank you!!!',0,1,tech,0.136,4
80,2018-12-01 23:05:53,honored to share the stage with   at   knowyourvalue conference for an important c xe2 x80 xa6 ,10,60,sports,0.136,2
81,2018-11-30 22:11:14,jiwoo lee was 14 when she used gene editing to kill cancer  now she's 19 and weighing in on the first gene edited b xe2 x80 xa6 ,39,89,sports,0.136,2
82,2018-11-30 19:56:44,    total snoozer',0,4,tech,0.136,4
83,2018-11-29 20:38:45,"rt  amazon conducted its hq2 search process like ""a hunger games of cities against each other for the benefit of the world xe2 x80 x99s ri xe2 x80 xa6'",14,0,tech,0.136,4
84,2018-11-29 19:51:56,riley morrison  xe2 x80 x94 you go girl! this is how change happens ,9,75,tech,0.136,4
85,2018-11-29 19:35:21,"if you xe2 x80 x99re looking for a career change, this looks like a pretty good option!  xe2 x81 xa6 climbs snow topped mountain xe2 x80 xa6 ",10,38,sports,0.136,2
86,2018-11-29 18:40:54,thank you   i xe2 x80 x99m so encouraged by the brave folks who xe2 x80 x99ve picked up the torch and are continuing to push for change  xf0 x9f x94 xa5 xe2 x80 xa6 ,3,34,tech,0.136,4
87,2018-11-29 04:07:33, xe2 x80 x9cthere xe2 x80 x99s a disparity between the people close to mark and his team and employees at the ground level   i didn xe2 x80 x99t wan xe2 x80 xa6 ,13,39,sports,0.136,2
88,2018-11-28 23:43:19,"rt  listen to  interview with  about the struggles of being black at facebook  he doesn't sound like xe2 x80 xa6""",20,0,sports,0.136,2
89,2018-11-27 15:11:59,"if you do one thing today, listen to this podcast  xe2 x80 x94 not sure what is more shocking, five women warehouse workers wh xe2 x80 xa6 ",139,229,sports,0.136,2
90,2018-11-21 16:32:27,"rt  investors just don't want to see the warning signs   nmaybe this time will be different?  n nfoxconn sounds the alarm, and it's a xe2 x80 xa6""",18,0,tech,0.136,4
91,2018-11-20 22:46:48," it's not at all like that, but this did make me laugh  a little """,0,4,sports,0.136,2
92,2018-11-20 21:12:38,"so, i got really sick one day and  generously agreed to fill in for me on studio 1 0  he even broke some xe2 x80 xa6 ",9,38,sports,0.136,2
93,2018-11-20 20:32:09,no  no  noooo  ,22,60,sports,0.136,2
94,2018-11-20 18:12:24,rt  tesla presented the buffalo operation as a sequel to the gigafactory  but large portions resemble an empty walmart supercent xe2 x80 xa6',14,0,world,0.136,1
95,2018-11-18 16:52:45,  thank you  wonder if we will  ever  find out where the fake report came from    ',0,2,tech,0.136,4
96,2018-11-16 04:22:17,"rt  sheryl sandberg speaks, says nyt reports that she  xe2 x80 x9cpersonally stood in the way xe2 x80 x9d of the public knowing more about russia on xe2 x80 xa6'",19,0,world,0.136,1
97,2018-11-15 23:43:47,"rt  uber 's  tells  that he doesn 't see any ""existential"" legal threats remaining for uber    but he won xe2 x80 xa6'",7,0,sports,0.136,2
98,2018-11-15 23:28:00,"uber 's chief legal officer  says they 're ""definitely"" considering ending forced arbitration for discrimina xe2 x80 xa6 ",4,10,business,0.136,3
99,2018-11-15 23:18:15,"""relentless""    the co founder of siri  says steve jobs called him 37 days in a row, and at midnight, to get t xe2 x80 xa6 ",13,30,business,0.136,3
100,2018-11-15 18:35:20,coming up! our exclusive with  chief legal officer   xe2 x80 x94  2ppt ,3,12,tech,0.136,4
101,2018-11-14 20:53:40,rt  a bot now tells financial times reporters if they xe2 x80 x99re only quoting men ,162,0,sports,0.136,2
102,2018-11-13 16:55:13,"jeff bezos will be spending a lot of time at both new headquarters says amazon svp jay carney, and pushes back on c xe2 x80 xa6 ",12,37,sports,0.136,2
103,2018-11-09 20:20:29, you just blew my mind!',0,6,tech,0.136,4
104,2018-11-09 20:03:35,"you could never recreate me in ai!!! um, right?? ",37,196,sports,0.136,2
105,2018-11-09 19:05:08,incoming    xe2 x80 x94 will scooters be the next segway or the next uber?? what happens in the winter? and in xe2 x80 xa6 ,12,38,sports,0.136,2
106,2018-11-09 03:29:56,"rt  the google ""c suite seems paralyzed, caught between whatever fallout will come with proceeding in china and the costs of ign xe2 x80 xa6'",25,0,tech,0.136,4
107,2018-11-09 03:26:09,rt  here xe2 x80 x99s the full maxine waters interview link   deutche n  wells n  cfpb   mick mulvaney n  fed n  hou xe2 x80 xa6',10,0,sports,0.136,2
108,2018-11-08 23:24:36, another new word! by this you mean we xe2 x80 x99re going backwards?',0,3,tech,0.136,4
109,2018-11-08 23:23:46,"rt  last week, 20,000 googlers staged a walkout to demand a more equitable workplace   n nthis week, google agrees to some (although xe2 x80 xa6'",420,0,business,0.136,3
110,2018-11-07 04:09:36,rt  update from facebook  company tells me it had to enforce its now stronger policy against voter suppression via misinformati xe2 x80 xa6',29,0,tech,0.136,4
111,2018-11-07 04:08:05,rt  big night for women  ,172,0,sports,0.136,2
112,2018-11-05 22:24:09,"what will  newly approved drug response test look like?  weighs in on the promise, and the cont xe2 x80 xa6 ",1,9,business,0.136,3
113,2018-11-05 22:15:21,"facebook 's crisis is just a ""little bump in the road""    my chat with billionaire investor  about social xe2 x80 xa6 ",2,9,business,0.136,3
114,2018-11-05 21:43:56,"my colleagues are updating this super cool live blog focused on tech related updates to the midterms, from cyber to xe2 x80 xa6 ",8,20,tech,0.136,4
115,2018-11-05 01:03:42,at the 7th annual  awards with  aka the  xe2 x80 x9coscars of science xe2 x80 x9d  xe2 x80 x94 and nearly my 7th time int xe2 x80 xa6 ,6,88,sports,0.136,2
116,2018-10-31 22:17:20,"marc  makes the case for prop c    calls it a ""crisis of inequality,"" says  and  can afford i xe2 x80 xa6 ",30,98,tech,0.136,4
117,2018-10-31 19:03:43,"marc  in the house, talking prop c on  ",8,107,world,0.136,1
118,2018-10-26 20:36:59,"progress isn't just slow, it's stalled  breaking down the latest women in the workplace report with  ",6,29,tech,0.136,4
119,2018-10-26 03:11:39,rt  great interview between  and  the part where katrina gives credit to  for helping ,13,0,tech,0.136,4
120,2018-10-25 23:00:40,google engineer  speaks out    how employees are reacting to the  bombshell that google paid  90 xe2 x80 xa6 ,49,175,tech,0.136,4
121,2018-10-25 22:53:26,the full edition of studio 1 0 with  ceo   if you're on the go    her xe2 x80 xa6 ,7,41,sports,0.136,2
122,2018-10-25 22:46:32,"our chat with twitter cfo     on earnings, the status of the clean up and of course, the president xe2 x80 xa6 ",1,14,business,0.136,3
123,2018-10-25 21:22:37, coming up right now on  to talk about   scoop ,1,13,sports,0.136,2
124,2018-10-25 20:37:00,alphabet cfo ruth porat also quoted from sundar's email re   misconduct story saying she's proud that googl xe2 x80 xa6 ,1,8,tech,0.136,4
125,2018-10-25 20:34:23,"just got off the phone with alphabet cfo ruth porat   says earnings boosted by mobile, global, cloud, ai, hardware  xe2 x80 xa6 ",9,40,tech,0.136,4
126,2018-10-25 17:35:17,wow  ,12,45,sports,0.136,2
127,2018-10-24 22:45:36,tonight! don xe2 x80 x99t miss  ceo  open up about her journey to become the youngest female founder to take xe2 x80 xa6 ,49,236,sports,0.136,2
128,2018-10-24 20:43:25,go team! ,4,33,sports,0.136,2
129,2018-10-23 20:00:23,"rt  i xe2 x80 x99m so excited to share that my first book, the moment of lift, will come out in april  this book is a chance for me to s xe2 x80 xa6'",305,0,sports,0.136,2
130,2018-10-22 22:32:39,obsessed with the  the daily podcasts on what xe2 x80 x99s happening in state elections  xe2 x80 x94 energizing and enraging  xe2 x80 x94 li xe2 x80 xa6 ,8,55,world,0.136,1
131,2018-10-22 18:15:11,rt  oculus's brendan iribe is the latest founder to leave facebook ,29,0,business,0.136,3
132,2018-10-22 16:49:38,super proud of what  is doing to boost women's voices across our coverage n n1  increasing   of women quote xe2 x80 xa6 ,255,959,tech,0.136,4
133,2018-10-18 17:43:31,earthquake drill at bloomberg! also  is baaaack!! ,8,49,tech,0.136,4
134,2018-10-18 17:35:14,  traveled to india to report this week's excellent and ironic  cover    where amazon    which ironica xe2 x80 xa6 ,7,23,tech,0.136,4
135,2018-10-18 16:19:31,rt  facebook has created an election war room   goes inside  xe2 x96 xb6 xef xb8 x8f ,52,0,world,0.136,1
136,2018-10-17 03:14:39,"fresh off raising a new  360m fund,    amp   on e commerce trends to watch, the impact of xe2 x80 xa6 ",11,62,business,0.136,3
137,2018-10-16 23:15:51,"three years ago  said definitively we were not in a bubble  today, he is not so sure  (and yes he still believ xe2 x80 xa6 ",10,33,sports,0.136,2
138,2018-10-16 17:33:18,"coming up today  first tv interview of the year! a super insightful convo about the advance of ai, xe2 x80 xa6 ",11,63,sports,0.136,2
139,2018-10-16 14:10:10,"rt  intel senior fellow  isn't questioning whether robots will take our jobs  she wants to know if they will share o xe2 x80 xa6""",10,0,tech,0.136,4
140,2018-10-16 03:01:35,"and yes,  weighed in (strongly) on saudi arabia and that medium post signed by anonymous microsoft emp xe2 x80 xa6 ",3,12,tech,0.136,4
141,2018-10-16 02:58:59,"loved this convo with   and her interpreter bel, about how ai can help the 1b people wi xe2 x80 xa6 ",26,94,tech,0.136,4
142,2018-10-15 20:28:27,coming to you live from the  25 conference with  genevieve bell aka   ,8,53,tech,0.136,4
143,2018-10-15 17:29:08,"rt  in honor of build's 20th anniversary, we're releasing 20 tickets to the  buildgala in our first ever ticket presale even xe2 x80 xa6""",4,0,sports,0.136,2
144,2018-10-15 16:38:02,don't miss the livestream tomorrow for bloomberg's sooner than you think    how tech is changing the future of mone xe2 x80 xa6 ,3,12,tech,0.136,4
145,2018-10-15 15:41:16,"well worth your time    a moving, if disquieting read by  about an unlikely romance between lawyer an xe2 x80 xa6 ",2,13,tech,0.136,4
146,2018-10-15 15:14:09,thrilled that  will be honored at the  gala this year  she has such an inspiring story to shar xe2 x80 xa6 ,2,19,tech,0.136,4
147,2018-10-10 20:16:03,about to hit the stage with  ceo nancy dubuc  xe2 x80 x94 her first time speaking publicly since taking the job!  vfsummit ,4,73,sports,0.136,2
148,2018-10-10 01:51:40,rt  u s  senators question super micro after bloomberg reports on chinese hardware hack  ,19,0,business,0.136,3
149,2018-10-09 16:14:28,"rt  a major u s  telco discovered manipulated hardware from super micro computer inc  in its network and removed it in august, s xe2 x80 xa6'",8,0,tech,0.136,4
150,2018-10-08 19:47:15,"rt  netflix is on the verge of acquiring an 8 stage production facility in new mexico, the first studio it would own outright  xe2 x80 xa6'",28,0,business,0.136,3
151,2018-10-08 19:43:28,"rt  exclusive   and  raise new  360 million fund, she talks with us exclusively about her plans  xe2 x80 xa6'",51,0,business,0.136,3
152,2018-10-08 16:12:52,rt  god speed to the marketers pitching a facebook branded home surveillance device  ,52,0,tech,0.136,4
153,2018-10-05 23:18:12,"rt  ceo  says data drives how the bill  amp  melinda gates foundation takes action  her thoughts on tech, philanthrop xe2 x80 xa6'",6,0,tech,0.136,4
154,2018-10-05 18:57:15,hear hear  ,0,17,business,0.136,3
155,2018-10-05 16:39:06,more insights on the big hack from  cto who's had a lot of oversight over tech supply chain    ,7,13,business,0.136,3
156,2018-10-05 16:38:11,"rt  welcome to the surreal world in which i say things like, ""i 'm pretty confident larry page is not a nymphomaniac ceo obsessed w xe2 x80 xa6'",10,0,tech,0.136,4
157,2018-10-05 02:36:48,a riveting satire of silicon valley by an unlikely author  xe2 x80 x94 former google pr head  tells us why she wrote t xe2 x80 xa6 ,12,30,tech,0.136,4
158,2018-10-03 22:42:22,rt   xe2 x9e xa1 xef xb8 x8f hypersonic planes?  n xe2 x9e xa1 xef xb8 x8f rockets to mars?  n xe2 x9e xa1 xef xb8 x8f flying cars?  n nwhat is a realistic future of air travel? watch ,14,0,tech,0.136,4
159,2018-10-03 18:50:59,coming to you momentarily from seattle! on  ,6,15,sports,0.136,2
160,2018-10-01 17:38:20,"rt  as we reported was likely, adam mosseri will be the next head of instagram  he joined instagram earlier this year after bei xe2 x80 xa6'",17,0,sports,0.136,2
161,2018-09-28 21:36:51,rt  a stark gender gap emerges in americans' view of kavanaugh ,29,0,world,0.136,1
162,2018-09-28 21:07:11,"rt  just in  president trump has ordered the fbi to conduct a supplemental investigation to update judge kavanaugh xe2 x80 x99s file  ""as the xe2 x80 xa6'",115,0,business,0.136,3
163,2018-09-28 17:38:43,you go girl! ,5,42,tech,0.136,4
164,2018-09-28 17:38:01,rt  i xe2 x80 x99m one of the countless white male founders execs investors  has interviewed on her show   n nthat needs to change  xe2 x80 xa6',5,0,business,0.136,3
165,2018-09-28 17:37:54,"not sure i deserve being in the same sentence as anita hill but thank you to anita, christine blasey ford, grace ho xe2 x80 xa6 ",12,80,sports,0.136,2
166,2018-09-28 15:14:10,"rt  the arc of history is long and does not bend in any particular direction because it's a random walk, but you can always try bendi xe2 x80 xa6""",30,0,sports,0.136,2
167,2018-09-28 15:13:17,alright! time to stop pouting and start talking  i xe2 x80 x99m speaking at  ghc18 in 15 mins  i xe2 x80 x99ll be taking pics with folks xe2 x80 xa6 ,13,90,sports,0.136,2
168,2018-09-28 14:23:04,turned off the news  watching anita hill speak before i go on stage at  ghc18  overwhelmed by how far we have come xe2 x80 xa6 ,24,139,sports,0.136,2
169,2018-09-27 17:41:40,"a rare sit down with  ceo     how he's leading through an acrimonious showdown with apple, xe2 x80 xa6 ",18,50,sports,0.136,2
170,2018-09-25 23:19:04,"my full convo with  on  dreamforce18, facebook as the  xe2 x80 x9cnew cigarettes, xe2 x80 x9d the departure of instagram xe2 x80 x99s co fou xe2 x80 xa6 ",70,247,business,0.136,3
171,2018-09-25 21:12:25,"extended interview with  on his new co ceo,  xe2 x80 x9cunshackling xe2 x80 x9d  magazine, equal pay and strong words for fa xe2 x80 xa6 ",23,96,business,0.136,3
172,2018-09-25 16:36:33,come to the bloomberg booth afterwards and we can take a picture! ,4,16,tech,0.136,4
173,2018-09-25 05:13:07,"kevin systrom on studio 1 0 two years ago    he talks at length about the decision to sell instagram, and working w xe2 x80 xa6 ",11,35,world,0.136,1
174,2018-09-25 03:10:38,rt  my sources say the instagram founders are leaving after increased tension with mark zuckerberg over the direction of the pr xe2 x80 xa6',365,0,world,0.136,1
